id,cambioResidencia,viajar,empresa,paisEmpresa,ciudad,provincia,pais,areaName,fechaHoraPublicacion,fechaHoraVence,experienciaAnos,skills,idiomas,descripcion,tipoTrabajo,tipoContrato,salarioDescripcion,salario,titulo,descripcionTitulo,categoria,edadMaxima,edadMinima,educacionMinima,cantidadVacante,modalidadTrabajo,empresaVerificada,anuncioRelevante,aptoDiscapacitado,promedioEmpresa
CCFCBC63962A7E5961373E686DCF3405,False,True,SURGE INGENIERIA CIA. LTDA,Ecuador,Quito,Pichincha,Ecuador,Almacén / Logística / Transporte,2024-09-03T10:19:20,2024-09-09T00:00:00,2,,,Empresa dedicada a Infraestructura para centro de procesamiento de datos ubicada en el Norte de  Quito. se encuentra en la búsqueda de un Operador de Bodega.		Requisitos:		Formación: Tecnología en carreras técnicas: electricidad. electrónica. telecomunicaciones o afines		Conocimientos Técnicos. identificación de equipos. herramientas. materiales. manejo de bodega e inventarios.	Experiencia: Mínimo dos años de experiencia en el área técnica. deseable en bodegas	De preferencia que resida en el sector Norte de Quito	Licencia de Conducir vigente con puntos	Habilidad para manejo de office		Persona emprendedora. dinámica con muchas ganas de trabajar para que formen parte de nuestro equipo de trabajo		Orden y Control		Trabajo en equipo		Responsabilidad		Iniciativa		Atención al cliente		Organización		Funciones a Desempeñar:		RECEPCION DE MATERIAL. EQUIPOS Y HERRAMIENTAS	ORGANIZAR Y ALMACENAR EL MATERIAL. EQUIPOS Y HERRAMIENTAS DE MANERA EFICIENTE EN LA BODEGA.	PREPARACION (PICKING) DE MATERIAL. EQUIPOS Y HERRAMIENTAS	DESPACHO DE MATERIALES. EQUIPOS Y HERRAMIENTAS CONFORME LOS REQUERIMIENTOS	REALIZAR LOS REGISTROS RESPECTIVOS DE LOS MOVIMIENTOS EN EL SISTEMA	APOYO EN TOMA DE INVENTARIOS	ORDEN Y LIMPIEZA EN LA BODEGA	SEGUIR LOS PROCEDIMEINTOS Y POLÍTICAS DE LA EMPRESA RELACIONADOS CON LA GESTIÓN DE LA BODEGA	Mínimo Nivel Académico Requerido	Técnico Graduado	Mínima Experiencia Laboral Requerida	2 años	,Tiempo Completo,Contrato por tiempo indefinido,A convenir,0,Operador de Bodega,Título Técnico,Almacén / Logística / Transporte,99,25,Educación Técnico/Profesional,1,Presencial,False,False,False,4.6
6D3DEC25FCBB609661373E686DCF3405,False,False,Ko hyang Jip ,Ecuador,Quito,Pichincha,Ecuador,Otros,2024-09-03T10:19:21,2024-09-03T10:19:21,4,Aceptación de errores y fracasos. Adaptación al cambio,,Una  persona que limpie. seque y arreglar menaje de la cocina. como barrer pisos. la cocina y trapear dejar limpio todo el área de la cocina. También sepa cosas básicas de cocina como cortar. freír. saltear etc. ,Medio Tiempo,Otro tipo de contrato,394.00 US$ (Mensual),394,pocillero,polifuncional,Otros,40,25,Educación Técnico/Profesional,1,Presencial,False,False,False,
068945A3AEF3675861373E686DCF3405,False,False,Los Volcanes Restaurant,Ecuador,Quito,Pichincha,Ecuador,Hostelería / Turismo,2024-09-03T10:19:21,2024-09-04T00:00:00,3,Adaptación al cambio. Autoconfianza. Capacidad de decisión. Gestión de las emociones. Superación. Manipulación de alimentos. Calidad. Gestión de inventarios,,Organizar.  asignar tareas. ejecutar. y supervisar el trabajo en cocina. Preparación de alimentos. gestión de tiempos en cocina. Realización y gestión de inventarios. ejecutar y supervisar buenas prácticas de manufactura y procesos.,Tiempo Completo,Contrato por tiempo indefinido,570.00 US$ (Mensual),570,Chef de partida,Formación y experiencia de 3 años.,Hostelería / Turismo,,,Educación Técnico/Profesional,1,Presencial,False,False,False,
38D7F1A0F7657A2461373E686DCF3405,False,False,RESTAURANTE LA RUA 1984,Ecuador,Quito,Pichincha,Ecuador,Otros,2024-09-03T10:19:21,2024-09-30T00:00:00,1,,,Se busca persona con experiencia en cocina ( Para bar escolar)	Requisitos:	Experiencia en el ámbito de bares escolares.	mantener el orden y limpieza	trabajar en equipo 	ser rapido y proactivo 	,Tiempo Completo,Contrato por tiempo indefinido,500.00 US$ (Mensual),500,Cocinero/a,cocinero/a para bar escolar,Otros,45,20,Educación Básica Secundaria,1,Presencial,False,False,False,
9E2389260D97EFAE61373E686DCF3405,False,True,Ganoitouch Ecuador,Ecuador,Quito,Pichincha,Ecuador,Administración / Oficina,2024-09-02T23:33:56,2024-09-09T00:00:00,1,,,Ingresar las facturas al sistema contable.	Elaborar los comprobantes de retención.	Analizar y Generar los asientos contables.	Contralar el debido uso de la caja chica en oficina central y realizar las reposiciones de caja chica en las sedes.	Revisar la solicitud de pedido de viáticos y proceder con el pago dependiendo de las fechas especificadas.	Elaborar las liquidaciones de compra una vez realizada la revisión de los soportes del gasto.	Cruzar la información de todos los gastos generados al mes con la información de la base datos del Servicio de Rentas Internas.	Revisar de manera mensual el estado de proveedores.	Procesar los pagos a proveedores.	Ejecutar la conciliación bancaria y tarjetas de crédito.	,Tiempo Completo,Contrato por tiempo indefinido,500.00 US$ (Mensual),500,Auxiliar contable,,Administración / Oficina,,,Educación Técnico/Profesional,1,Presencial,False,False,True,
A001A775E80DB7E961373E686DCF3405,False,False,ARIAS HERNANDEZ RUBI MARIA PATRICIA,Ecuador,Quito,Pichincha,Ecuador,Hostelería / Turismo,2024-09-02T23:33:56,2024-09-02T23:33:56,1,Adobe Ilustrator. Adobe Photoshop. Adobe Premier. Adobe InDesign,,Eres Diseñador/a y buscas un lugar para desarrollarte profesionalmente. ¡Ésta es tu oportunidad! Estamos buscando una persona creativa y apasionada que esté lista para sumergirse en el mundo del diseño y contribuir con nuevas ideas y perspectivas frescas.		Responsabilidades:		• Colaborar con el equipo de marketing en la creación de diseños para el producto. 	• Asistir en la conceptualización y desarrollo de conceptos creativos para campañas de marketing y promoción.	• Apoyar en la producción y edición de contenido multimedia. como imágenes y videos.	• Elaborar materiales visuales para diversos proyectos. incluyendo gráficos para redes sociales. folletos. carteles. presentaciones. entre otros.	• Contribuir con ideas innovadoras y soluciones creativas para los desafíos de diseño.	• Mantenerse al día con las tendencias actuales en diseño gráfico y software relacionado.		Requisitos:	• Últimos semestres o graduado en Diseño Gráfico. Diseño Multimedia o un campo relacionado.	• Conocimiento de herramientas de diseño gráfico y paquetes de adobe.	• Fuertes habilidades creativas y atención al detalle.	• Capacidad para trabajar en equipo y comunicarse eficazmente.	• Pasión por el diseño y el deseo de aprender y crecer en el campo.		Beneficios:	• Oportunidades de aprendizaje y desarrollo profesional.	• Mentoría por parte de diseñadores experimentados.	• Exposición a una amplia gama de proyectos y clientes.	• Ambiente de trabajo colaborativo y amigable.		Si estás listo(a) para comenzar tu carrera en diseño gráfico y ser parte de un equipo dinámico y creativo. ¡postula ahora! Envía tu currículum vitae y un portafolio que muestre ejemplos de tu trabajo creativo. ¡Esperamos ver tu talento y potencial!	,Tiempo Completo,Contrato por tiempo indefinido,460.00 US$ (Mensual),460,Diseñador gráfico,creativo,Hostelería / Turismo,40,20,Universidad,2,Presencial,False,False,False,
204F9BE927453C0161373E686DCF3405,False,False,Intersa,Ecuador,Quito,Pichincha,Ecuador,Informática / Telecomunicaciones,2024-09-02T23:33:57,2024-09-06T00:00:00,3,Adaptación al cambio,Inglés ,Se requiere tres desarrolladores a tiempo completo que tengan suficiente experiencia para proyectos de app.	Trabajo preferible presencial y es necesario demostrar la experiencia que se tenga en desarrollo para platadformas moviles ,Tiempo Completo,Contrato por tiempo indefinido,A convenir,0,Desarrollador Flutter,con experiencia,Informática / Telecomunicaciones,34,20,Universidad,3,Híbrido,False,False,True,3.9
EDD0BD231D1E550861373E686DCF3405,False,True,Disetec Cia.Ltda.,Ecuador,Quito,Pichincha,Ecuador,Atención a clientes,2024-09-02T23:33:57,2024-09-13T00:00:00,4,Microsoft Excel,Inglés ,NOTA: Leer muy bien la información antes de postular.	Se necesita una persona que sea creativa. que no acepte un NO por respuesta para venga y sea parte de la empresa. No importa el género solo las ganas de trabajar y la dinámica de vender. Tendrá que sujetarse a las pruebas de rigor. 	Profesional en el mercado minero. experiencia de al menos 4 años comprobables.	Estudios en Ingeniera Mecánica. Industrial. Eléctrica. Electro- mecánico.		Beneficios:	Sueldo más comisiones	Oportunidad de crecimiento laboral.	Capacitación constante.	Excelente ambiente laboral.		Responsabilidades:	Captación de clientes y bienes	Brindar asesorías comerciales	Seguimiento a clientes	Cumplimiento del presupuesto mensual	,Tiempo Completo,Otro tipo de contrato,A convenir,0,Vendedor minero,,Atención a clientes,40,30,Universidad,1,Presencial,False,False,True,4.4
5CF4AA841A9C894061373E686DCF3405,False,False,SALESLAND ,Ecuador,Quito,Pichincha,Ecuador,Ventas,2024-09-02T23:33:57,2024-09-03T00:00:00,1,,,ADJUNTE SU CONTACTO EN LA PARTE DE DESCRIPCIÓN	Salesland. distribuidor autorizado busca un Vendedor en Campo - Medio Tiempo para la cuenta de Netlife. 		Requisitos: 	- Bachiller	- Experiencia en ventas de preferencia de servicios de internet. 	- Experiencia de ventas en campo.		Ofrecemos:	Beneficios de Ley	Sueldo Base + Comisiones,Medio Tiempo,Otro tipo de contrato,A convenir,0,Vendedor en campo,Quito,Ventas,35,20,Bachillerato / Educación Media,10,Presencial,False,False,False,
E846CDBBE1AE57B761373E686DCF3405,False,False,INMEQ S.C.C,Ecuador,Quito,Pichincha,Ecuador,Almacén / Logística / Transporte,2024-09-02T23:33:57,2024-09-16T00:00:00,3,,,Importante empresa del sector Ferretero y Agro-industrial. requiere incorporar a su equipo de trabajo un Jefe de Logística. Distribución y Bodega. por favor postular únicamente las personas que cumplan con el siguiente perfil:		REQUISITOS:	- Título de tercer nivel en administración de empresas. Logística o carreras a fines.	- Experiencia mínima de 3 años en cargos de jefatura en el área de bodega	- Edad hasta 32 años de edad.	FUNCIONES	- Planificar y programar las actividades y recursos necesarios para el funcionamiento eficiente de las operaciones diarias.	- Coordinar las actividades de la bodega. logística y distribución. asegurando que se cumplan los plazos y objetivos establecidos por la empresa.	- Identificar. proponer e implementar mejoras e innovaciones a los procesos logísticos y de bodega. optimizando los recursos que permitan el incremento de la productividad.	HABILIDADES	- Ordenado. organizado y que tenga metodología de trabajo.	- Pro-activo. buena actitud 	- Buen trabajo en equipo y bajo presión 	- Liderazgo y buena atención al cliente tanto interno como externo.   ,Tiempo Completo,Contrato por tiempo indefinido,A convenir,0,Jefe de Logística Distribución y Bodega,Con experiencia,Almacén / Logística / Transporte,32,27,Educación Técnico/Profesional,1,Presencial,False,False,False,
D35CD348D76DC2B361373E686DCF3405,False,False,LA BARBERIA STUDIO,Ecuador,Quito,Pichincha,Ecuador,Otros,2024-09-02T23:33:58,2024-09-02T23:33:58,3,,,Se necesita barbero CON EXPERIENCIA comprobable mínima 3 años	Buena atención al cliente	Trabajo bajo presión	Horarios rotativos	Conocimientos en todo tipo de cortes. limpiezas faciales. etc...,Tiempo Completo,Otro tipo de contrato,A convenir,0,Barbero,Con experiencia,Otros,35,23,Bachillerato / Educación Media,1,Presencial,False,False,False,
5B2BBA1E2D1ACCAA61373E686DCF3405,False,False,PAREDES  MUÑOZ MARIA ISABEL,Ecuador,Quito,Pichincha,Ecuador,Mercadotecnia / Publicidad / Comunicación,2024-09-02T23:33:58,2024-09-15T00:00:00,2,,,Estamos en la búsqueda de un Coordinador de Marketing con sólidos conocimientos en estrategias ATL y BTL. El candidato ideal será responsable de planificar. ejecutar y supervisar campañas de marketing que integren medios masivos (ATL) y activaciones de marca directas (BTL) para impulsar el crecimiento y reconocimiento de nuestra marca. Se requiere experiencia mínima de 3 años en un rol similar. habilidades analíticas para evaluar el rendimiento de las campañas. capacidad para trabajar en equipo y coordinar proyectos. así como una mentalidad orientada a resultados. Ofrecemos un entorno dinámico de trabajo. oportunidades de crecimiento profesional y un paquete salarial competitivo. ¡Únete a nuestro equipo y contribuye al éxito de nuestra empresa!,Tiempo Completo,Otro tipo de contrato,A convenir,0,Coordinador de Marketing,Con Experiencia en Publicidad ATL y BTL,Mercadotecnia / Publicidad / Comunicación,,,Educación Técnico/Profesional,1,Presencial,False,False,True,
A0453062A0C420D161373E686DCF3405,False,True,Sistemas Abiertos de Información y Tecnología SAIT,Ecuador,Quito,Pichincha,Ecuador,Ingeniería,2024-09-02T23:33:58,2024-09-15T00:00:00,-1,AutoCAD. Microsoft Office,Inglés ,Practicas para Arquitectura que les permitirá aprender software CAD. BIM y Civil.	Se requiere conocimientos de AutoCAD. Revit. Civil3D.	La persona escogida trabajará a medio tiempo en modo híbrido que se acordará en la reunión de selección. Debe tener portatil Windows con los requerimientos mínimos para correr software CAD.,Medio Tiempo,Contrato de Aprendizaje,A convenir,0,Practicas Arquitectura,Medio tiempo,Ingeniería,60,24,Universidad,2,Híbrido,False,False,True,
AEAC86DDF5CCC12E61373E686DCF3405,False,False,GOBIERNO AUTONOMO DESCENTRALIZADO DEL DISTRITO METROPOLITANO DE QUITO,Ecuador,Quito,Pichincha,Ecuador,Medicina / Salud,2024-09-02T23:33:58,2024-09-18T00:00:00,,,,UNIDAD METROPOLITANA DE QUITO.	Nueva postulación de trabajo estamos en Busca de personas con o sin experiencia para laborar en nuestro centro de salud contratación de manera independiente.	Contar con el tiempo disponible para iniciar el proceso de vinculación de contrato. ,Medio Tiempo,Contrato por tiempo determinado,850.00 US$ (Mensual),850,auxiliar contable.Auxiliar de enfermería. psicólogo clínico.,Turno de día contrato por 6 meses de labor.,Medicina / Salud,,,Educación Técnico/Profesional,96,Presencial,False,False,True,3.1
B3E851800E816FF561373E686DCF3405,False,False,TIMESHARING,Ecuador,Quito,Pichincha,Ecuador,CallCenter / Telemercadeo,2024-09-02T23:33:58,2024-09-15T00:00:00,3,Planificación. Promoción. Asesoría comercial,,Recuperación de cartera. call center. atención a clientes. análisis de bases de datos. 	Gestionar y coordinar las reservas de departamentos y servicios adicionales. realizar seguimiento y confirmación de reservas. procesar pagos. realizar cobros pendientes y mantener actualizada la información de cuentas por cobrar.	Brindar un excelente servicio al cliente. tanto en persona como por teléfono o correo electrónico.	,Tiempo Completo,Otro tipo de contrato,458.00 US$ (Mensual),458,Cobranzas y Reservas,,CallCenter / Telemercadeo,0,21,Educación Técnico/Profesional,1,Presencial,False,False,True,
0946FA796C6CEA2B61373E686DCF3405,False,False,CHOCOCYRIL CIA LTDA,Ecuador,Quito,Pichincha,Ecuador,Hostelería / Turismo,2024-09-02T13:43:18,2024-09-02T13:43:18,2,,,Estamos en la en la búsqueda de un asistente contable. 	Requisitos: 	•	titulo en Contabilidad o cursando últimos años de universidad. 	•	experiencia en el Área contable mínima de 2 años. 	•	capacidad para solución de problemas.	Competencias Técnicas:	•	Conocimientos en contabilidad y tributación	•	Registro de compras y elaboración de retenciones (normativa actualizada)	•	Elaboración y manejo de cash plataformas bancos	•	Análisis de cuentas. proveedores. clientes. anticipos. gastos	•	Manejo de caja chica. de reembolsos. tarjeta corporativa	•	Conciliacion bancaria.	•	Cuadre de cajas y arqueos	•	Declaraciones de IVA. FUENTE Y elaboración de ATS y demás Anexos. además del manejo de plataformas de regulación. SRI. SUPER CIAS. MRL. SUT. SUPA	•	Trabajo en Equipo. orientación a resultados. proactivo. integro y comunicativo	•	Conocimientos básicos de Office	Disponibilidad Inmediata,Tiempo Completo,Contrato por tiempo indefinido,500.00 US$ (Mensual),500,Asistente contable,Cyril,Hostelería / Turismo,30,20,Educación Técnico/Profesional,1,Presencial,False,False,True,
9A2884857D71AADB61373E686DCF3405,False,False,Attenza DF Ecuador S.A,Ecuador,Quito,Pichincha,Ecuador,Mercadotecnia / Publicidad / Comunicación,2024-09-02T10:17:45,2024-09-02T10:17:45,2,Adaptación al cambio. Análisis. Atención al cliente. Redes Sociales. Fotografía,Español .Inglés ,Realizar Merchandinsing en base a las directrices de casa matriz y marcas en el piso de ventas	Brindar apoyo a en la publicidad en el piso de ventas.	Gestionar y coordinar montajes en tiendas. siguiendo los lineamientos establecidos por las marcas.	Realizar reportes fotográficos.	Mantener control de todas las imágenes en muebles y cajas de luz.	Enviar reportes a casa matriz sobre la ejecución de la implementación de cambios de imágenes,Tiempo Completo,Contrato por tiempo indefinido,700.00 US$ (Mensual),700,Trade marketing,Mercadeo. publicidad. orientación resultados.,Mercadotecnia / Publicidad / Comunicación,30,22,Universidad,1,Presencial,False,False,False,4.5
214EEA76AFD785D161373E686DCF3405,False,True,TELCOEXPRESS S.A.,Ecuador,Quito,Pichincha,Ecuador,Informática / Telecomunicaciones,2024-09-02T08:22:33,2024-09-08T00:00:00,,Adaptación al cambio. Capacidad de decisión. Asesoría comercial. Administración de sistemas,,Somos una empresa fabricante y distribuidora de equipos del sector de Telecomunicaciones y equipos para el sector Industrial y Soluciones de Seguridad. Tenemos acuerdos nacionales e internacionales con diferentes fábricas y distribuidores permitiendo mantener un extenso portafolio de productos de las marcas más reconocidas a nivel mundial.  	Nuestro equipo de trabajo está altamente capacitado en las diferentes marcas que comercializamos permitiendo llevar a nuestros clientes el mejor asesoramiento. 		Preparación requerida: 	personal con nivel Técnico o Ingenierías Electrónica. Telecomunicaciones. Informática. Eléctrica o áreas afines. 	Experiencia: 	Experiencia en Radio Enlaces. Networking. Fibra óptica (GPON) 	Experiencia en comercialización de materiales o equipos (De preferencia / No obligatorio) 	Experiencia y conocimientos en manejo de laboratorios para calibración de equipos de medición conocidos como OTDR. 		Indispensable contar con Equipo de calibración. Conocido como Línea de Retardo Recirculante (se dará altamente la preferencia de contratación a quien cuente con este equipo)	Contar con OTDR (No necesario)	Contar con certificación vigente en calibración del OTDR (Necesario se tomará en cuenta para asignar el puesto) 	Se están ofreciendo 5 vacantes para este puesto.	Puesto ofrecido Gerente de Laboratorio en mantenimiento de equipos.	Sueldo mensual garantizado ofrecido $2.075 dólares más comisiones o bonos por buen desempeño.	Requisitos: 	Tener licencia de conducir 	Experiencia en manejo de carretera 	Excelente presentación personal 	Poder salir de viaje una semana al mes dentro de su mismo país.	Preferentemente contar con VISA para viajar para recibir capacitaciones en USA. México y Costa Rica. 	Habilidades: 	Comunicación Efectiva 	Trabajo en Equipo 	Trabajo Bajo presión 	Orientación a resultados 	Requerimientos 	Educación mínima: Técnico Especializado. Universidad 	2 años de experiencia 	Idiomas: Español Inglés básico técnico. 	Edad: entre 25 y 55 años 	,Tiempo Completo,Contrato por tiempo indefinido,A convenir,0,Tecnico o Ingeniero en Sistemas. Telecomunicaciones. Electronica.,áreas afines a ingenierías,Informática / Telecomunicaciones,56,23,Educación Técnico/Profesional,5,Híbrido,False,False,True,
CCA2967DE1E1964561373E686DCF3405,False,False,ARIAS DIAZ BRYAN ALEXIS,Ecuador,Quito,Pichincha,Ecuador,Ventas,2024-08-31T04:14:17,2024-08-31T04:14:17,2,Atención al cliente. Gestión de ventas. Servicio al cliente. Ventas. Call Center,Español ,¡Únete a Nuestro Equipo como Asesor Comercial!	¿Eres un apasionado del mundo de las ventas y las relaciones comerciales? ¿Tienes al menos 2 años de experiencia y buscas una oportunidad para crecer y desarrollarte en una empresa innovadora? ¡Te estamos buscando!		¿Quiénes Somos?	Somos Carico Internacional una empresa líder en tecnologías para la salud. dedicada a mejorar el bienestar de la gente. Nos enorgullece ofrecer soluciones innovadoras y crear relaciones duraderas con nuestros clientes.		Lo Que Ofrecemos:	Ambiente Dinámico: Trabaja en un entorno motivador y lleno de oportunidades.	Desarrollo Profesional: Programas de capacitación continua y oportunidades de crecimiento.	Beneficios: Competitivos	Flexibilidad: Horarios flexibles y posibilidad de trabajo remoto.		Responsabilidades:	Gestionar y expandir la cartera de clientes.	Identificar oportunidades de negocio y desarrollar estrategias de ventas.	Asesorar a los clientes sobre nuestras soluciones y servicios.	Cumplir con los objetivos de ventas establecidos.	Colaborar con el equipo para mejorar continuamente los procesos de ventas.		Requisitos:	Experiencia mínima de 2 años en ventas o asesoría comercial.	Excelentes habilidades de comunicación y negociación.	Orientación al cliente y capacidad para establecer relaciones sólidas.	Proactividad y capacidad para trabajar de manera autónoma.	Conocimiento en Educación. Salud. Seguros es un plus.,Tiempo Completo,Otro tipo de contrato,A convenir,0,Asesores Comerciales,con Experiencia,Ventas,60,18,Bachillerato / Educación Media,5,Presencial,False,False,False,
DF07933E0AF1359E61373E686DCF3405,False,False,RAMIREZ VIÑANZACA GABRIELA ELIZABETH,Ecuador,Quito,Pichincha,Ecuador,Medicina / Salud,2024-08-30T14:58:41,2024-09-08T00:00:00,1,Iniciativa,,Profesional en Medica. para atención en consulta externa en Centro de Especialidades. Horarios flexibles a convenir entre las partes. Atención previo agendamiento de citas. Honorarios se requiere emisión de factura. a convenir.,Por Horas,Otro tipo de contrato,A convenir,0,Médico Especialista,Medicina Familiar y otros,Medicina / Salud,,,Postgrado,1,Presencial,False,False,False,
C7E33C5D3AB2EEFD61373E686DCF3405,True,True,TC TELEVISION,Ecuador,Quito,Pichincha,Ecuador,Mercadotecnia / Publicidad / Comunicación,2024-08-30T12:53:26,2024-09-28T00:00:00,,,,Se requiere animadora ancor para programa de entretenimiento farandula	indispensable tener excelente presencia conocer de farandula y poseer carisma contactarse con karen Vanderdys al movil ceronueveseis ochoceroseis cerocuatrounonueve	o al correo recursoshumanos#tctelevision.info ,Tiempo Completo,Contrato por tiempo indefinido,A convenir,0,animadora  farandula (solo mujeres),para programa nuevo de farandula,Mercadotecnia / Publicidad / Comunicación,26,17,Educación Básica Secundaria,4,Híbrido,False,False,False,
9DB23832B044663661373E686DCF3405,False,False,ARIAS VACA ERICK DANIEL,Ecuador,Rumiñahui,Pichincha,Ecuador,Otros,2024-08-30T12:19:02,2024-08-30T12:19:02,-1,,,Tejedoras Experimentadas	Resumen del Puesto	Buscamos Tejedoras Experimentadas para unirse a nuestro equipo. Las candidatas ideales tendrán un fuerte conocimiento de las técnicas de tejido a mano. como el punto y el ganchillo. y serán capaces de trabajar de forma independiente y como parte de un equipo.	Responsabilidades	Tejer a mano una linea de productos de amigurumi.	Seguir patrones y especificaciones con precisión.	Cumplir con los plazos establecidos.	Mantener un alto nivel de calidad en su trabajo.	Requisitos	Experiencia previa en tejido a mano.	Conocimiento de una variedad de técnicas de tejido. incluyendo el punto y el ganchillo.	Capacidad para trabajar de forma independiente y como parte de un equipo.	Excelente atención al detalle.	Capacidad para cumplir con los plazos establecidos.,Por Horas,Otro tipo de contrato,A convenir,0,Tejedoras Experimentadas,Trabajo desde casa,Otros,,,Bachillerato / Educación Media,50,Remoto,False,False,True,
17AA3410C284C30D61373E686DCF3405,False,False,BUSTAMANTE FABARA S.A.S.,Ecuador,Quito,Pichincha,Ecuador,Legal / Asesoría,2024-08-30T12:19:02,2024-09-02T00:00:00,2,Adaptación al cambio. Servicio al cliente,,Limpieza profunda de oficinas. pisos. baños. cafeterías. todo lo relacionado a limpieza	Ayuda en mensajería. ingresando y retirando documentos en diferentes instituciones,Tiempo Completo,Otro tipo de contrato,475.00 US$ (Mensual),475,Conserje Mensajero,Conserje Mensajero,Legal / Asesoría,45,18,Bachillerato / Educación Media,1,Presencial,False,False,True,
130AEFE1EFC1730E61373E686DCF3405,False,False,GRANJA ROMO DIEGO ANDRES,Ecuador,Quito,Pichincha,Ecuador,Ventas,2024-08-30T12:19:01,2024-09-02T00:00:00,2,Atención al cliente. Comunicación y persuasión. Gestión de ventas. Negociación. Ventas,Español ,¿Eres un experto en ventas con un enfoque orientado a resultados? ¡Te estamos buscando! Únete a nuestro equipo de vendedores puerta a puerta y lleva tu carrera al siguiente nivel.,Tiempo Completo,Otro tipo de contrato,A convenir,0,Vendedores,Puerta a puerta,Ventas,50,21,Educación Técnico/Profesional,19,Presencial,False,False,True,
