id,cambioResidencia,viajar,empresa,paisEmpresa,ciudad,provincia,pais,areaName,fechaHoraPublicacion,fechaHoraVence,experienciaAnos,skills,idiomas,descripcion,tipoTrabajo,tipoContrato,salarioDescripcion,salario,titulo,descripcionTitulo,categoria,edadMaxima,edadMinima,educacionMinima,cantidadVacante,modalidadTrabajo,empresaVerificada,anuncioRelevante,aptoDiscapacitado,promedioEmpresa
893C1A278158330B61373E686DCF3405,False,False,BairesDev LLC,Argentina,Quito,Pichincha,Ecuador,Informática / Telecomunicaciones,2024-09-09T13:39:55,2024-09-09T13:39:55,5,SQL Server. Tecnología de la información. Lean. Agile,Inglés ,At BairesDev®. we've been leading the way in technology projects for over 15 years. We deliver cutting-edge solutions to giants like Google and the most innovative startups in Silicon Valley. 		Our diverse 4.000+ team. composed of the world's Top 1% of tech talent. works remotely on roles that drive significant impact worldwide.		When you apply for this position. you're taking the first step in a process that goes beyond the ordinary. We aim to align your passions and skills with our vacancies. setting you on a path to exceptional career development and success.		Data Engineer at BairesDev		We are looking for a Data Engineer to join our Development team and participate in different projects made up of multicultural teams distributed worldwide.		What You Will Do:		- Interview other Data Scientists and Data engineers to vet their technical abilities. 	- Input data from those interviews into the product and help develop a predictive. fair. and enjoyable solution. 	- Work together with developers. tech leads. and solution architects to build applications.	- Improve existing structures by adding new functionalities or proposing technological updates so that as a result. the impact of your contribution is significant in the core of each business.	- Improve the user experience on scalable and high-availability platforms. contributing to the key differential of each business.		Here’s what we are looking for:		- 5+ years of experience working as a developer.	- 3+ years of experience working as a Data Scientist / Data Engineer.	- Proficient with analysis. troubleshooting. and problem-solving.	- Hands-on experience with managing data loads and data quality.	- Advanced English level.		How we do make your work (and your life) easier:		- 100% remote work (from anywhere).	- Excellent compensation in USD or your local currency if preferred	- Hardware and software setup for you to work from home.	- Flexible hours: create your own schedule.	- Paid parental leaves. vacations. and national holidays.	- Innovative and multicultural work environment: collaborate and learn from the global Top 1% of talent.	- Supportive environment with mentorship. promotions. skill development. and diverse growth opportunities.		Apply now and become part of a global team where your unique talents can truly thrive!,Tiempo Completo,Otro tipo de contrato,A convenir,0,Work From Home Data Engineer,Ref. 0960E,Informática / Telecomunicaciones,,,Educación Técnico/Profesional,3,Remoto,True,False,True,
E9255719825ADB3E61373E686DCF3405,False,False,BairesDev LLC,Argentina,Quito,Pichincha,Ecuador,Informática / Telecomunicaciones,2024-09-09T13:39:35,2024-09-09T13:39:35,5,Tecnología de la información. Lean. Agile,Inglés ,En BairesDev® llevamos 15 años liderando proyectos de tecnología para clientes como Google. Rolls-Royce y las startups más innovadoras de Silicon Valley. Actualmente. contamos con un equipo de 4000 profesionales conformado por el top 1% de la industria trabajando de forma remota desde más de 50 países. 		Al postularte a esta vacante. estarás dando el primer paso en un proceso que va más allá de lo convencional: Buscaremos conocer en profundidad tus habilidades. intereses y expectativas con el objetivo de realizar una búsqueda personalizada y encontrar el rol ideal para ti en BairesDev.		Desarrollador ETL en BairesDev		Buscamos Desarrolladores ETL para sumarse al equipo de Desarrollo y participar en distintos proyectos conformados por equipos multiculturales distribuidos en todo el mundo. Buscamos personas proactivas. dinámicas y team players. con gran capacidad de organización. acostumbradas a manejar múltiples tareas y con marcada atención al detalle. Se trata de una excelente oportunidad para aquellos profesionales que busquen desarrollarse en una de las empresas con mayor crecimiento de la industria! 		Estos desarrolladores enfrentarán numerosos desafíos técnicos. por lo cual deberán utilizar tecnologías actuales. involucrarse en el mundo mobile. de aplicaciones web. dispositivos. etc.		Principales responsabilidades:		- Diseñar y desarrollar (mejoras y mantenimiento) nuevas soluciones ETL.	- Mejorar los trabajos de ejecución lenta con la ayuda del rediseño y mejores procesos ETL para satisfacer las necesidades comerciales.	- Apoyar al equipo para diseñar. modelar. desarrollar y mantener los objetos de bases de datos SQL existentes y nuevos. necesarios para todas las soluciones de negocios.		¿Qué Buscamos?:		-5+ años de experiencia en el desarrollo de soluciones ETL y experiencia en el diseño e implementación de modelos de bases de datos relacionales según las necesidades del negocio.	- Experiencia en desarrollo de bases de datos. diseño. análisis. soporte en entornos de desarrollo. pruebas y producción con diversos dominios comerciales.	- La experiencia de Python es una gran ventaja.	- La licenciatura en informática o equivalente es altamente deseable.	- Nivel de inglés avanzado.		¿Qué Ofrecemos?:		Qué ofrecemos para que tu trabajo (y tu vida) sea más fácil:		- Trabajo 100% remoto: trabaja desde tu casa o donde quieras.	- Compensación en USD o en tu moneda local. como prefieras. muy por encima de la media del mercado.	- Hardware y software.	- Horarios flexibles	- Licencias por mater/paternidad. vacaciones y días festivos nacionales pagos.	- Ambiente laboral multicultural e innovador. perfecto para hacer amigos. colaborar y aprender de las personas más talentosas del mundo.	- Oportunidades de crecimiento y desarrollo profesional a través de mentorías y entrenamientos.		¡Únete a nuestro equipo global!																						,Tiempo Completo,Contrato por tiempo indefinido,A convenir,0,Trabajo Desde Casa Desarrollador ETL,Ref. 0339S,Informática / Telecomunicaciones,,,Universidad,3,Remoto,True,False,True,
4FBED42FA905420361373E686DCF3405,False,False,BairesDev LLC,Argentina,Quito,Pichincha,Ecuador,Informática / Telecomunicaciones,2024-09-09T13:39:15,2024-09-09T13:39:15,5,Tecnología de la información. Lean. Agile,Inglés ,En BairesDev® llevamos 15 años liderando proyectos de tecnología para clientes como Google. Rolls-Royce y las startups más innovadoras de Silicon Valley. Actualmente. contamos con un equipo de 4000 profesionales conformado por el top 1% de la industria trabajando de forma remota desde más de 50 países. 		Al postularte a esta vacante. estarás dando el primer paso en un proceso que va más allá de lo convencional: Buscaremos conocer en profundidad tus habilidades. intereses y expectativas con el objetivo de realizar una búsqueda personalizada y encontrar el rol ideal para ti en BairesDev.		Ingeniero ETL en BairesDev		Buscamos Ingenieros ETL para unirse a nuestro equipo de Desarrollo y participar en diferentes proyectos formados por equipos multiculturales distribuidos por todo el mundo. Buscamos personas proactivas. y team players apasionados por la programación en este lenguaje y orientados a brindar la mejor experiencia al usuario final. Se trata de una excelente oportunidad para aquellos profesionales que buscan desarrollarse en una de las empresas de mayor crecimiento del sector.		Estos desarrolladores se enfrentarán a numerosos retos técnicos. por lo que deberán utilizar tecnologías actuales. e involucrarse en el mundo móvil. aplicaciones web. dispositivos. etc.		Actividades Principales:		- Diseñar y desarrollar (mejoras y mantenimiento) nuevas soluciones ETL.	- Mejorar los trabajos de ejecución lenta con la ayuda de rediseño y mejores procesos ETL para satisfacer las necesidades del negocio.	- Apoyar al equipo para diseñar. modelar. desarrollar y mantener objetos de base de datos SQL existentes y nuevos necesarios para todas las soluciones empresariales.		¿Qué Buscamos?:		- 5+ años de experiencia en el desarrollo de Soluciones ETL y experiencia en el diseño e implementación de modelos de Bases de Datos Relacionales según las necesidades del negocio.	- Experiencia en desarrollo. diseño. análisis y soporte de bases de datos en entornos de desarrollo. pruebas y producción con diversos dominios empresariales.	- Experiencia en Python es una gran ventaja.	- Licenciatura en Informática o equivalente es altamente deseable.	- Nivel avanzado de inglés.		¿Qué Ofrecemos?:		Qué ofrecemos para que tu trabajo (y tu vida) sea más fácil:		- Trabajo 100% remoto: trabaja desde tu casa o donde quieras.	- Compensación en USD o en tu moneda local. como prefieras. muy por encima de la media del mercado.	- Hardware y software.	- Horarios flexibles	- Licencias por mater/paternidad. vacaciones y días festivos nacionales pagos.	- Ambiente laboral multicultural e innovador. perfecto para hacer amigos. colaborar y aprender de las personas más talentosas del mundo.	- Oportunidades de crecimiento y desarrollo profesional a través de mentorías y entrenamientos.		¡Únete a nuestro equipo global!																						,Tiempo Completo,Contrato por tiempo indefinido,A convenir,0,Trabajo Desde Casa Ingeniero ETL,Ref. 0339S,Informática / Telecomunicaciones,,,Universidad,3,Remoto,True,False,True,
0183134624E3212661373E686DCF3405,False,False,BairesDev LLC,Argentina,Quito,Pichincha,Ecuador,Informática / Telecomunicaciones,2024-09-09T13:38:55,2024-09-09T13:38:55,4,Linux. UNIX. Tecnología de la información. Testeo. Lean. Agile. Test-driven development (TDD),Inglés ,En BairesDev® llevamos 15 años liderando proyectos de tecnología para clientes como Google. Rolls-Royce y las startups más innovadoras de Silicon Valley. Actualmente. contamos con un equipo de 4000 profesionales conformado por el top 1% de la industria trabajando de forma remota desde más de 50 países. 		Al postularte a esta vacante. estarás dando el primer paso en un proceso que va más allá de lo convencional: Buscaremos conocer en profundidad tus habilidades. intereses y expectativas con el objetivo de realizar una búsqueda personalizada y encontrar el rol ideal para ti en BairesDev.		Probador de Software (QA) / Investigación y Desarrollo en BairesDev		Estamos buscando al mejor talento para la posición de Probador de Software (QA) para unirse al equipo de Investigación y Desarrollo (I+D) de BairesDev.	Nuestro equipo de I+D es una parte esencial de nuestras soluciones tecnológicas que generan millones de ingresos cada año. por lo que sólo contratamos a los mejores talentos de todo el mundo.	Dentro del equipo encontrarás muchos retos diferentes: Análisis de datos. Machine Learning. Desktop y Desarrollo web son algunos de los más relevantes en este momento. pero para impulsar la innovación. te darás cuenta de que algo nuevo se presenta cada día.	El área de I+D es sin duda la más interesante y desafiante de toda la empresa. y aunque BairesDev está conformada por gente realmente talentosa en general. aquí encontrarás profesionales con amplia experiencia y del más alto nivel intelectual y creativo.	¿Estás listo para sumarte a nuestro equipo?		Actividades Principales:		- Analizar requisitos del usuario final para definir y documentar los planes de prueba.	- Ejecutar casos de prueba. depurar. detectar errores y/o posibles mejoras. documentarlos y hacer un seguimiento para su resolución.	- Generar informes de los resultados de las pruebas y errores detectados.	- Definir las prioridades y planificar las pruebas de los requisitos del sistema.	- Documentar las funcionalidades de los sistemas.	- Representar al usuario final ante los desarrolladores para garantizar el cumplimiento de los requisitos.	- Detectar y proponer mejoras tanto en el proceso de control de calidad como en el ciclo de desarrollo del software.		¿Qué Buscamos?:		- 4+ años de experiencia en testing de productos Web.	- Sólidos conocimientos en herramientas de Testing.	- Desarrollar planes de pruebas: Creación de casos de pruebas y depuración.	- Conocimientos en Tecnologías Web.	- Sólidos conocimientos en sistemas operativos de Unix y Linux.	- Nivel de Inglés y Portugués avanzado.		¿Qué Ofrecemos?:		Qué ofrecemos para que tu trabajo (y tu vida) sea más fácil:		- Trabajo 100% remoto: trabaja desde tu casa o donde quieras.	- Compensación en USD o en tu moneda local. como prefieras. muy por encima de la media del mercado.	- Hardware y software.	- Horarios flexibles	- Licencias por mater/paternidad. vacaciones y días festivos nacionales pagos.	- Ambiente laboral multicultural e innovador. perfecto para hacer amigos. colaborar y aprender de las personas más talentosas del mundo.	- Oportunidades de crecimiento y desarrollo profesional a través de mentorías y entrenamientos.		¡Únete a nuestro equipo global!																						,Tiempo Completo,Contrato por tiempo indefinido,A convenir,0,Trabajo Desde Casa Probador de Software (QA) / Investigación y Desarrollo,Ref. 0027S (RD),Informática / Telecomunicaciones,,,Universidad,10,Remoto,True,False,True,
2E5B3EA034EFE3D661373E686DCF3405,False,False,BairesDev LLC,Argentina,Quito,Pichincha,Ecuador,Informática / Telecomunicaciones,2024-09-09T13:38:39,2024-09-09T13:38:39,5,Linux. UNIX. Tecnología de la información. Testeo. Lean. Agile. Test-driven development (TDD),Inglés ,En BairesDev® llevamos 15 años liderando proyectos de tecnología para clientes como Google. Rolls-Royce y las startups más innovadoras de Silicon Valley. Actualmente. contamos con un equipo de 4000 profesionales conformado por el top 1% de la industria trabajando de forma remota desde más de 50 países. 		Al postularte a esta vacante. estarás dando el primer paso en un proceso que va más allá de lo convencional: Buscaremos conocer en profundidad tus habilidades. intereses y expectativas con el objetivo de realizar una búsqueda personalizada y encontrar el rol ideal para ti en BairesDev.		Analista de QA Senior / Investigación y Desarrollo en BairesDev		Estamos buscando un Analista QA Senior excepcional para unirse al equipo de Investigación y Desarrollo (I+D) de BairesDev.	Nuestro equipo de I+D es una parte esencial de nuestras soluciones tecnológicas que impulsan millones en ingresos cada año. por lo que solo contratamos lo mejor de lo mejor.	Dentro del equipo encontrarás muchos retos diferentes: Análisis de datos. Machine Learning. Desktop y desarrollos web son algunos de los más relevantes ahora mismo. pero para impulsar la innovación. ¡notarás que cada día surgen cosas nuevas!	El área de I+D es. sin duda. la más emocionante y desafiante de toda la empresa. Aunque gente con mucho talento. en general. conforma BairesDev. aquí encontrarás profesionales con amplia experiencia y también niveles intelectuales y creativos. muy por encima de la media.	Queremos que la gente disfrute del viaje. ¿Estás preparado?		Actividades Principales:		- Analizar los requisitos del usuario final para definir y documentar los planes de prueba.	- Ejecutar casos de prueba. depurar. detectar errores y/o posibles mejoras. documentarlos y hacer un seguimiento para su resolución.	- Generar informes de resultados de pruebas y errores detectados.	- Definir las prioridades y planificar las pruebas de los requisitos del sistema.	- Documentar las funcionalidades de los sistemas.	- Representar al usuario final ante los desarrolladores para garantizar que se cumplen los requisitos.	- Detectar y proponer mejoras tanto en el proceso de control de calidad como en el ciclo de desarrollo de software.		¿Qué Buscamos?:		- 5+ años de experiencia en pruebas de productos Web.	- Sólidos conocimientos de herramientas de testing.	- Desarrollo de planes de prueba: creación de casos de prueba y depuración.	- Conocimientos adicionales en tecnologías Web.	- Amplios conocimientos de entornos Unix y Linux.	- Nivel avanzado de inglés.		¿Qué Ofrecemos?:		Qué ofrecemos para que tu trabajo (y tu vida) sea más fácil:		- Trabajo 100% remoto: trabaja desde tu casa o donde quieras.	- Compensación en USD o en tu moneda local. como prefieras. muy por encima de la media del mercado.	- Hardware y software.	- Horarios flexibles	- Licencias por mater/paternidad. vacaciones y días festivos nacionales pagos.	- Ambiente laboral multicultural e innovador. perfecto para hacer amigos. colaborar y aprender de las personas más talentosas del mundo.	- Oportunidades de crecimiento y desarrollo profesional a través de mentorías y entrenamientos.		¡Únete a nuestro equipo global!																						,Tiempo Completo,Contrato por tiempo indefinido,A convenir,0,Trabajo Desde Casa Analista de QA Senior / Investigación y Desarrollo,Ref. 0027S (RD),Informática / Telecomunicaciones,,,Universidad,3,Remoto,True,False,True,
C53899341D9F6B9A61373E686DCF3405,False,False,BairesDev LLC,Argentina,Quito,Pichincha,Ecuador,Informática / Telecomunicaciones,2024-09-09T13:38:16,2024-09-09T13:38:16,7,CSS. JavaScript. Tecnología de la información. AngularJS. Lean. Agile. HTML 5,Inglés ,En BairesDev® llevamos 15 años liderando proyectos de tecnología para clientes como Google. Rolls-Royce y las startups más innovadoras de Silicon Valley. Actualmente. contamos con un equipo de 4000 profesionales conformado por el top 1% de la industria trabajando de forma remota desde más de 50 países. 		Al postularte a esta vacante. estarás dando el primer paso en un proceso que va más allá de lo convencional: Buscaremos conocer en profundidad tus habilidades. intereses y expectativas con el objetivo de realizar una búsqueda personalizada y encontrar el rol ideal para ti en BairesDev.		Ruby on Rails Tech Lead en BairesDev		Si eres un líder por naturaleza con experiencia como mentor. ¡Este es el trabajo para ti!	Como Líder Tech de Ruby on Rails en nuestro equipo de Desarrollo. tu misión será supervisar técnicamente a un equipo de desarrolladores de Front y Back End.	Trabajarás en un equipo global de ritmo acelerado encargado de llevar la innovación al siguiente nivel. La innovación está en el corazón de la estrategia de BairesDev. 		Actividades principales:  		- Refactorizar el comportamiento en contextos aislados y acotados.	- Trabajar en estrecha colaboración con el equipo de cara al cliente para detectar las características.	- Gestionar su tiempo y ser responsable con una supervisión mínima.		¿Qué Buscamos?:		- Gestión avanzada de metodologías ágiles.	- Conocimiento avanzado de patrones de diseño.	- Conocimiento avanzado de infraestructura IT.	- Experiencia en seguridad.	- Experiencia en el desarrollo/integración de aplicaciones a gran escala.	- Especialización completa en áreas de desarrollo Backend y Frontend.	- Sólida experiencia en revisión de código y gestión de pipelines CI/CD.	- Conocimiento experto de las ventajas/debilidades de los requisitos del cliente.	- Conocimiento avanzado de las ventajas y desventajas de elegir una determinada tecnología.	- Sólida experiencia participando en reuniones con clientes. usuarios y partes interesadas.	- Experiencia liderando equipos. asignando tareas. identificando riesgos. tomando decisiones. estimando tareas. gestionando conflictos y planificando.	- Nivel de inglés avanzado.		¿Qué Ofrecemos?:		Qué ofrecemos para que tu trabajo (y tu vida) sea más fácil:		- Trabajo 100% remoto: trabaja desde tu casa o donde quieras.	- Compensación en USD o en tu moneda local. como prefieras. muy por encima de la media del mercado.	- Hardware y software.	- Horarios flexibles	- Licencias por mater/paternidad. vacaciones y días festivos nacionales pagos.	- Ambiente laboral multicultural e innovador. perfecto para hacer amigos. colaborar y aprender de las personas más talentosas del mundo.	- Oportunidades de crecimiento y desarrollo profesional a través de mentorías y entrenamientos.		¡Únete a nuestro equipo global!																						,Tiempo Completo,Contrato por tiempo indefinido,A convenir,0,Trabajo Desde Casa Ruby on Rails Tech Lead,Ref. 0026S,Informática / Telecomunicaciones,,,Universidad,1,Remoto,True,False,True,
B6E0F31668CD9F1061373E686DCF3405,False,False,BairesDev LLC,Argentina,Quito,Pichincha,Ecuador,Informática / Telecomunicaciones,2024-09-09T13:37:56,2024-09-09T13:37:56,4,Linux. UNIX. C. C++. Java. Python. Tecnología de la información. Testeo. Lean. Agile. Test-driven development (TDD),Inglés ,En BairesDev® llevamos 15 años liderando proyectos de tecnología para clientes como Google. Rolls-Royce y las startups más innovadoras de Silicon Valley. Actualmente. contamos con un equipo de 4000 profesionales conformado por el top 1% de la industria trabajando de forma remota desde más de 50 países. 		Al postularte a esta vacante. estarás dando el primer paso en un proceso que va más allá de lo convencional: Buscaremos conocer en profundidad tus habilidades. intereses y expectativas con el objetivo de realizar una búsqueda personalizada y encontrar el rol ideal para ti en BairesDev.		Ingeniero de Automatización de QA / Investigación y Desarrollo en BairesDev		Buscamos un sobresaliente Ingeniero de Automatización de QA para sumarse al equipo de Investigación y Desarrollo de BairesDev (I + D).	Nuestro equipo de I + D es parte esencial de nuestras soluciones tecnológicas que generan millones en ingresos cada año. por lo que sólo contratamos a los mejores de los mejores.	Dentro del equipo. encontrarás muchos desafíos diferentes: Análisis de datos. Aprendizaje Automático. Desarrollos de escritorio y web son algunos de los más relevantes en este momento. pero para impulsar la innovación. ¡notarás que surgen cosas nuevas todos los días!	El área de I + D es sin duda el área más interesante y desafiante de toda la empresa. y aunque BairesDev está conformada por personas realmente talentosas en general. aquí encontrarás profesionales con amplia experiencia y también nivel intelectual y creativo. muy por encima de la media.	Queremos que disfrutes de esta aventura. ¿estás listo?		Actividades Principales:		- Trabajar en estrecha colaboración con los desarrolladores para crear casos de prueba. diseñar planes de prueba y automatizar casos de prueba para la verificación de la funcionalidad del producto.	- Trabajar en estrecha colaboración con desarrolladores. dueños de Productos y Scrum Masters para revisar los requisitos y el diseño del producto.	- Administrar y realizar un seguimiento de errores y mejoras (a través de JIRA y las herramientas aplicables).	- Investigar y analizar defectos de productos.	- Desarrollar e implementar la estrategia de Automatización de Pruebas.	- Generar textos de prueba automatizados de nivel API utilizando diversas tecnologías y herramientas.		¿Qué Buscamos?:		- 5+ años de experiencia en automatización de pruebas.	- Destreza para trabajar con C. C++. Java y Python.	- Conocimientos sólidos en ambientes de Unix y Linux.	- Nivel de Inglés avanzado.		Qué ofrecemos para que tu trabajo (y tu vida) seja mais fácil:		- Trabajo 100% remoto: trabaja desde tu casa o donde quieras.	- Compensación en USD o en tu moneda local. como prefieras. muy por encima de la media del mercado.	- Hardware y software.	- Horarios flexibles	- Licencias por mater/paternidad. vacaciones y días festivos nacionales pagos.	- Ambiente laboral multicultural e innovador. perfecto para hacer amigos. colaborar y aprender de las personas más talentosas del mundo.	- Oportunidades de crecimiento y desarrollo profesional a través de mentorías y entrenamientos.		¡Únete a nuestro equipo global!,Tiempo Completo,Contrato por tiempo indefinido,A convenir,0,Trabajo Desde Casa Ingeniero de Automatización de QA / Investigación y Desarrollo,Ref. 0050S (RD),Informática / Telecomunicaciones,,,Universidad,10,Remoto,True,False,True,
