id,cambioResidencia,viajar,empresa,paisEmpresa,ciudad,provincia,pais,areaName,fechaHoraPublicacion,fechaHoraVence,experienciaAnos,skills,idiomas,descripcion,tipoTrabajo,tipoContrato,salarioDescripcion,salario,titulo,descripcionTitulo,categoria,edadMaxima,edadMinima,educacionMinima,cantidadVacante,modalidadTrabajo,empresaVerificada,anuncioRelevante,aptoDiscapacitado,promedioEmpresa
DFAA78586C82FECE61373E686DCF3405,False,False,Centro Educativo Antonio Flores,Ecuador,Quito,Pichincha,Ecuador,Docencia,2024-08-12T15:20:51,2024-08-12T15:20:51,1,,,Desarrollar proyectos de investigación e innovación relacionados con la ciencia contable e indisciplinares. con rigurosidad. pertinencia y calidad.	 planifica. diseña. implementa y evalúa situaciones de enseñanza-aprendizaje para desarrollar competencias en sus estudiantes por medio del uso de la didáctica y las TIC.		,Tiempo Completo,Contrato por tiempo indefinido,460.00 US$ (Mensual),460,Profesora de contabilidad,con experiencia,Docencia,35,20,Universidad,1,Presencial,False,False,True,
B4499C8574C8AEFC61373E686DCF3405,False,False,INTERCUSTVAL CIA LTDA,Ecuador,Rumiñahui,Pichincha,Ecuador,Ventas,2024-08-12T15:20:51,2024-09-01T00:00:00,1,Dirección de ventas. Gestión de ventas. Habilidad comercial. networking. Ventas. Asesoría comercial,,Experiencia previa en ventas. preferiblemente en el sector de seguros.	Fuertes habilidades de comunicación verbal y escrita. con la capacidad de explicar conceptos complejos de manera sencilla.	Orientado a resultados. con una sólida ética de trabajo y capacidad para trabajar de manera independiente.	Excelentes habilidades de negociación y capacidad para cerrar ventas.	Conocimiento básico de los principios y términos de seguros.,Tiempo Completo,Contrato por tiempo indefinido,A convenir,0,Asesor,Seguros,Ventas,55,18,Bachillerato / Educación Media,5,Híbrido,False,False,True,
A678F2E2A1F1677F61373E686DCF3405,False,False,ALBERTO ANDINO Y ASOCIADOS CIA LTDA,Ecuador,Quito,Pichincha,Ecuador,Ventas,2024-08-12T15:20:51,2024-08-18T00:00:00,2,Microsoft Excel. Microsoft Word. Atención al cliente. Inmobiliaria. Publicidad. Ventas. Redes Sociales. Redacción. Internet,,Constructora requiere contratar para formar parte de su equipo de trabajo un Asesor o Asesora Inmobiliaria para promocionar sus proyecto que debe tener experiencia en asesoramiento de crédito hipotecarios. financiamiento. seguimientos de clientes.. entre sus funciones será tratar con todos los diferentes clientes interesados e nuestros poryectos	Su Jornada de trabajo sera tiempo completo debe tener conocimiento comprobado en manejo y utilización de  CRM para su gestión de ventas Buscar y cultivar nuevos clientes 	Debe tener disponibilidad trabajar fines de semana Conocimientos en técnicas de ventas sector inmobiliario. negociación y relaciones con clientes Experiencia comprobada en venta de proyectos inmobiliarios. manejo de paquetes básicos de computación. y CRM,Tiempo Completo,Contrato por tiempo indefinido,476.00 US$ (Mensual),476,Asesor/a comercial,Asesor Inmobiliario,Ventas,45,25,Universidad,1,Presencial,False,False,True,
434C70F53E30DBEA61373E686DCF3405,False,False,JURADO-GROUP CIA. LTDA,Ecuador,Quito,Pichincha,Ecuador,Atención a clientes,2024-08-12T15:20:52,2024-08-12T15:20:52,,Microsoft Office,,Se requiere pasante contable que realice las siguientes funciones: Ingreso de Información al sistema contable. cruce de cajas. cuentas por cobrar y cuentas por pagar. ingreso de retenciones en ventas. trabajo conjunto con contabilidad y gerencia. (El convenio de Pasantes es de 6 meses con opción a contrato por tiempo completo dependiendo el desempeño en la pasantia) De preferencia que el postulante resida en el sector norte de Quito.,Beca/Prácticas,Otro tipo de contrato,A convenir,0,Pasante Contable,,Atención a clientes,28,18,Bachillerato / Educación Media,1,Presencial,False,False,True,
3744376F85EE2EA461373E686DCF3405,False,False,CONSORCIO CONTINENTAL CADC S.A,Ecuador,Quito,Pichincha,Ecuador,CallCenter / Telemercadeo,2024-08-12T15:20:52,2024-08-13T00:00:00,1,,,-Gestión de cuotas a clientes no adjudicados. barrido de cartera y cartera preventiva.	-Atención al cliente. recopilación de datos. servicios de cobranza.,Tiempo Completo,Contrato por tiempo indefinido,460.00 US$ (Mensual),460,Asistente Post Venta,,CallCenter / Telemercadeo,0,18,Bachillerato / Educación Media,4,Presencial,False,False,True,
44F2DB5A3F71B9DE61373E686DCF3405,False,False,Beehunting,Ecuador,Quito,Pichincha,Ecuador,Diseño / Artes gráficas,2024-08-12T15:20:52,2024-09-01T00:00:00,-1,,,Ser Mayor de Edad	Experiencia en creación y edición de videos. imágenes para redes sociales.	Dominios de Herramientas de Edición.	Creatividad y Habilidad de Comunicación.	Capacidad para generar ideas y tendencias.	Residir en Quito.,Tiempo Completo,Contrato por tiempo indefinido,474.00 US$ (Mensual),474,Creador de Contenido Para Redes Sociales,,Diseño / Artes gráficas,,,Educación Básica Secundaria,1,Híbrido,False,False,True,
BC1C96DCA085C6C761373E686DCF3405,False,False,EAGLESECURITY COMPAÑIA LIMITADA,Ecuador,Quito,Pichincha,Ecuador,Ventas,2024-08-12T15:20:49,2024-08-18T00:00:00,2,Atención al cliente. Dirección de ventas. Gestión de las emociones. Gestión de ventas,,Experiencia en ventas de servicios: Preferentemente con experiencia en la venta de servicios de seguridad y limpieza. o en sectores similares. Deberá conocer bien el mercado y tener la capacidad de identificar y captar nuevos clientes.		Autonomía y proactividad: Dado que será la única persona en el área de ventas. se requiere que sea altamente independiente. organizada. y capaz de tomar la iniciativa para alcanzar los objetivos comerciales.		Habilidades de negociación y cierre: Debe tener un fuerte enfoque en resultados y ser experta en negociar contratos y cerrar ventas efectivas.		Comunicación efectiva: Habilidades excepcionales de comunicación. tanto verbal como escrita. para interactuar con clientes potenciales y existentes. así como con otros departamentos de la empresa.		Gestión de relaciones: Capacidad para construir y mantener relaciones a largo plazo con los clientes. asegurando un alto nivel de satisfacción y fidelización.		Conocimiento del mercado: Con una visión clara del mercado local y la competencia. para poder posicionar los servicios de la empresa de manera efectiva.		Capacidad de adaptación: Flexibilidad para adaptarse a diferentes situaciones y clientes. y capacidad para manejar múltiples tareas a la vez.		Orientación a resultados: Enfocada en cumplir y superar las metas de ventas establecidas. con un enfoque en la rentabilidad y el crecimiento de la empresa.,Tiempo Completo,Contrato de obra o labor,A convenir,0,Agente de ventas,dia,Ventas,26,23,Bachillerato / Educación Media,1,Presencial,False,False,False,
9863EBCF17B1B9FB61373E686DCF3405,False,False,HARDWARE DOCTOR,Ecuador,Quito,Pichincha,Ecuador,Mantenimiento y Reparaciones Técnicas,2024-08-12T15:20:52,2024-08-13T00:00:00,2,,,Estamos en la búsqueda de un Técnico de Software altamente capacitado y con un mínimo de 2 años de experiencia en el sector. La persona ideal debe contar con sólidos conocimientos en la línea de soporte técnico de computadoras. impresoras.	Capacitación y soporte a usuarios finales.	Disponibilidad inmediata 	Excelentes habilidades interpersonales y de comunicación.	Estudios en sistemas o similares 	Salario competitivo acorde a la experiencia.,Tiempo Completo,Contrato por tiempo indefinido,A convenir,0,Mantenimiento y soporte técnico,Tecnico de Sotfware,Mantenimiento y Reparaciones Técnicas,30,22,Educación Técnico/Profesional,1,Presencial,False,False,False,
8ACC9AF3C6D1420E61373E686DCF3405,False,False,SERTECPRIV CIA LTDA,Ecuador,Quito,Pichincha,Ecuador,Docencia,2024-08-12T12:21:41,2024-09-01T00:00:00,5,,,Diseñar programas de capacitación técnica de acuerdo con los requisitos de la organización	Confeccionar horarios de capacitación y la agenda del aula	Impartir el contenido del curso de acuerdo con los objetivos		Para lo cual debes cumplir con los siguientes requisitos:	1. Ser ecuatoriano o extranjero con autorizacion para trabajar	2. Tener entre 28 y 69 años	3. Certificado de reconocimiento de evaluación psiquiatrica. psicólogica forense y de análisis toxicologico	4. No tener antecedentes penales	5. Experiencia laboral mínima 5 años en conocimiento de armas de fuego. tipo de armas. manipulación.arme . desarme. munición. caracteristicas individuales. técnicas de tiro. seguridad con las armas de fuego en instalaciones de tiro	6. Certificación por competencias laborales en formador de formadores. avalado por el Ministerio de Trabajo	7. Curso instructor de armas (150 Horas)	8. Para miembros de Fuerzas Armadas y Policia Nacional en servicio pasivo (certificado de no haner sido dado de baja y/o destituido por mala conducta. acto administrativo u orden judicial)		,Por Horas,Contrato de obra o labor,A convenir,0,Capacitador/a armas,Para escuela de Guardias de Seguridad,Docencia,0,28,Universidad,2,Híbrido,False,False,False,
C7A2AF6199277BF461373E686DCF3405,False,False,Goddard Catering Group,Ecuador,Quito,Pichincha,Ecuador,Hostelería / Turismo,2024-08-12T12:30:29,2024-08-18T00:00:00,1,Servicio al cliente,Español ,Buscamos un Ayudante de Cocina apasionado por la atención al cliente. Debe ser diligente. organizado y dispuesto a colaborar en todas las tareas relacionadas con el servicio de alimentos:	-Título de Bachiller o Carreras técnias como: Gastronomía.	-1 año de experiencia previa en catering. servicio de alimentos. o roles similares.	-Conocimientos en normas de higiene y BPMs.	-Contar con movilización propia.	-Disponibilidad para trabajar en horarios rotativos.	¿Estás listo/a para unirte a una aventura emocionante y llena de desafíos? 	,Tiempo Completo,Otro tipo de contrato,463.00 US$ (Mensual),463,ayudante de cocina para comedor industrial,con movilizacion,Hostelería / Turismo,35,21,Educación Técnico/Profesional,6,Presencial,False,False,True,4.3
FBD02BEE21F0EF0061373E686DCF3405,False,False,RyA Tech,Ecuador,Quito,Pichincha,Ecuador,Ventas,2024-08-11T14:06:47,2024-08-12T00:00:00,2,Dirección de ventas. Gestión de ventas. Marketing. Ventas. Asesoría comercial,Español ,Se requiere asesor comercial / vendedor con experiencia en la cuidad de Quito.		Ventas Online via whatsapp. la empresa propociona el flujo de clientes interesados los cuales deberan ser atendidos por el asesor comercial previamente capacitado por nuestra empresa.		Requisitos:	Fluides de palabra. buena redaccion. empatia. dominio del computador. entusiasta. puntual. organizado. y responsable.		 Cumplimiento de meta asignado. cotizaciones y cierres de ventas diaros. que pueda superar metas de la empresa y personales. para contratacion inmediata.		Indispensable tener experiencia en ventas de cualquier tipo. (Minimo 2 años de experiencia)		Conocimientos: Microsoft Excel. Microsoft Outlook. Whatsapp.,Medio Tiempo,Otro tipo de contrato,A convenir,0,Asesor/a comercial,Con Experiencia,Ventas,50,20,Bachillerato / Educación Media,10,Presencial,False,False,True,
CEBFF283206B8EE361373E686DCF3405,False,False,BUSINESS PRAKTIKO PRAKBUSINESS CIA LTDA,Ecuador,Quito,Pichincha,Ecuador,Informática / Telecomunicaciones,2024-08-09T11:09:06,2024-08-15T00:00:00,1,Java. Python. ASP.NET MVC Web API. HTML 5,,Proponer mejoras a diseños y procesos actuales del software PRAKTIKO y aplicativos.	Desarrollar software para funcionamiento y soporte web conforme arquitectura vigente.	Colaborar con el equipo actual de desarrollo en el impulso de nuevos proyectos tanto en back como en front.,Medio Tiempo,Otro tipo de contrato,A convenir,0,Desarrollador full stack,On line,Informática / Telecomunicaciones,99,20,Educación Técnico/Profesional,1,Remoto,False,False,True,
9CCFBA8C79C51CFA61373E686DCF3405,False,False,Corporación Fernandez S.A.,Ecuador,Quito,Pichincha,Ecuador,Legal / Asesoría,2024-08-09T10:57:46,2024-08-31T00:00:00,,Asesoría legal,,Los abogados. al proteger los derechos de sus clientes y defender la causa de la justicia. procurarán apoyar los derechos humanos y las libertades fundamentales reconocidos por el derecho nacional e internacional. y en todo momento actuarán con libertad y diligencia. de conformidad con la ley y las reglas y normas ...		Funciones:		Brindar orientación legal a sus clientes.	Representar a sus clientes en los tribunales. en asuntos privados de índole legal y ante entidades gubernamentales.	Investigar. recopilar evidencia. argumentar la defensa de su cliente de acuerdo a la ley vigente.			,Tiempo Completo,Contrato por tiempo determinado,2.200.00 US$ (Mensual),2200,Abogado Jurido,,Legal / Asesoría,48,19,Universidad,50,Presencial,False,False,False,4.2
38F682BFE720ACB061373E686DCF3405,False,False,SERVICIOS DE APOYO SAN LUIS SPA,Chile,Quito,Pichincha,Ecuador,Ventas,2024-08-09T09:55:41,2024-09-02T00:00:00,2,,,Importante empresa multinacional de seguridad se encuentra en búsqueda de Ejecutivo/a comercial con experiencia en venta de Servicios y productos asociados quien tendrá como objetivo principal la generación de ventas de servicios de profesionales y proyectos relacionados B2B. 	Buscamos sumar a nuestro equipo a persona con alta motivación. con una alta capacidad para plantear objetivos y estrategias eficaces para alcanzar ventas a corto plazo. por lo mismo es requisito que cuente con cartera de clientes. 	Funciones principales: 	• Prospección y generación de nuevas oportunidades de negocios con clientes potenciales. 	• Promoción y venta de servicios y productos de seguridad (idealmente) 	• Generar reuniones con clientes. preparación de propuestas. negociación y cierre de ventas de servicios. 	• Experiencia mínima de 2 año en cargo comercial relacionado. 	Requisitos indispensables:	• Titulo nivel Superior. Ingeniería Comercial o afín. 	• Cartera de clientes activa (comprobable y excluyente) 	• Experiencia en negociación y cierre de tratos con clientes. 	• Office y Excel a nivel intermedio (Informes de gestión y presentaciones). 	• Disponibilidad para trabajo hibrido. 	Se ofrece una contratación estable. sueldo base acorde al mercado. comisiones sin tope. entre otros beneficios.	 Si esta oportunidad laboral es de tu interés. postula con nuestro equipo.			,Tiempo Completo,Contrato por tiempo indefinido,A convenir,0,Ejecutivo/a Comercial (KAM),,Ventas,,,Educación Técnico/Profesional,2,Híbrido,False,False,True,
24D380B0AC9D6D6961373E686DCF3405,False,False,R&A SOLUTIONS,Ecuador,Quito,Pichincha,Ecuador,Ventas,2024-08-09T09:55:41,2024-08-11T00:00:00,1,Dirección de ventas. Gestión de ventas. Ventas. Asesoría comercial,Español ,Se requiere asesor de ventas/vendedor con experiencia en la cuidad de Quito.		Ventas Online via whatsapp. la empresa propociona el flujo de clientes interesados los cuales deberan ser atendidos por el asesor de ventas previamente capacitado por nuestra empresa.		Requisitos:	Fluides de palabra. buena redaccion. empatia. dominio del computador. entusiasta. puntual. organizado. y responsable.		Se requiere cumplimiento de meta asignado. cotizaciones y cierres de ventas diaro. que pueda superar metas de la empresa y personales. para contratacion inmediata.		Indispensable tener experiencia en ventas de cualquier tipo.		Conocimientos: Microsoft Excel. Microsoft Outlook. Whatsapp		,Medio Tiempo,Otro tipo de contrato,A convenir,0,Agente de ventas,Con Experiencia,Ventas,50,20,Bachillerato / Educación Media,8,Presencial,False,False,True,
997FF0E382BE9FA061373E686DCF3405,False,False,Refua Acupuntura,Ecuador,Quito,Pichincha,Ecuador,Medicina / Salud,2024-08-09T09:55:41,2024-08-09T09:55:41,1,Salud,,Estamos en la busca de acupunturistas. Fisioterapistas. quiroprácticos y osteopatas con títulos certificados. para trabajar en nuevo proyecto de medicina a domicilio. qué tengan facilidad de movilización y tiempo para trabajar en esta modalidad,Por Horas,Otro tipo de contrato,A convenir,0,Tarapistas,,Medicina / Salud,,,Educación Técnico/Profesional,5,Híbrido,False,False,False,
88BCF6D33C57249F61373E686DCF3405,False,False,ESMATEX S.A.,Ecuador,Quito,Pichincha,Ecuador,Diseño / Artes gráficas,2024-08-08T15:47:54,2024-08-08T15:47:54,,,,Detalles de la oferta:		Perfil: Estudiante (Pasante) o recién egresada 	Experiencia: 1 año comprobable en diseño grafico o afines 	Horario: A convenir	Disponibilidad inmediata		- Experiencia comprobada en Diseño Grafico vectorial .		- Excelentes habilidades de comunicación y apertura al aprendizaje.		Responsabilidades:		- Realizar dibujos en pixeles para piezas textiles.		- Ilustración vectorial para prendas.,Medio Tiempo,Contrato de Aprendizaje,A convenir,0,Diseñadora Grafica Junior,Tiempo parcial,Diseño / Artes gráficas,30,19,Educación Técnico/Profesional,1,Presencial,False,False,True,3.3
40853E6169365F2C61373E686DCF3405,False,False,Thc,Ecuador,Quito,Pichincha,Ecuador,Ventas,2024-08-08T15:47:54,2024-08-08T15:47:54,,Reclutamiento,Español ,Mbrindar soporte en toda el área de talento humano saber sobre plataformas de Mies sut. mdt etc	Contribuir al la comida y las liquidaciones de la empresa ,Tiempo Completo,Contrato por tiempo indefinido,460.00 US$ (Mensual),460,Asistente de talento humano,Tiempo completo,Ventas,,,Universidad,1,Presencial,False,False,False,
14BDDB21AAFEB10361373E686DCF3405,True,True,DINAMIKA GROUP S.A.C.,Perú,Quito,Pichincha,Ecuador,Ventas,2024-08-08T14:11:54,2024-08-12T00:00:00,,Adaptación al cambio,Inglés ,	Funciones		 Apoyar en la planificación. coordinación y ejecución de de las acciones de 	 gerencia general	 Responsable de licitaciones publicas. hacer seguimiento a las demás areas para la elaboración de documentación técnica.	 Encargada de todo el archivo a cargo de Gerencia General	Atención a clientes corporativos del país y extranjero	 Coordinación con proveedores del exterior que maneje gerencia.	 Coordinar y concretar reuniones. encuentros. citas y otras actividades afines	 Planificar la agenda del gerente	 Colaborar y trabajar en unidad con los demás integrantes del departamento administrativo.		Requisitos		 Egresados o Bachilleres en carreras administrativas. ingeniería empresarial o afines	 Dominio de ingles (Avanzado)	 Conocimientos Financieros y comercial	 Disponibilidad de Viajar	 Office avanzado	,Tiempo Completo,Contrato por tiempo determinado,A convenir,0,Asistente de Gerencia Comercial,Tiempo completo,Ventas,50,20,Universidad,1,Híbrido,False,False,False,
09D6B9A8C1D55CB661373E686DCF3405,True,True,DINAMIKA GROUP S.A.C.,Perú,Quito,Pichincha,Ecuador,Servicios Generales. Aseo y Seguridad ,2024-08-08T14:11:54,2024-08-12T00:00:00,5,Adaptación al cambio,Inglés ,¿A QUIÉN BUSCAMOS?	- Formación académica: Profesional universitario en Ingeniería Mecánica. Ingeniería Eléctrica o Ingeniería Industrial con mención en Refrigeración Industrial	- Office a nivel intermedio. AutoCAD. Ms Project.	- TPM. RCM. Análisis Causa Raíz.	- Conocimiento general de la parte mecánica del funcionamiento de equipos.	- Inglés a nivel intermedio.	- Experiencia mínima de 05 años en puestos similares en empresas del rubro industrial.		¿CUÁLES SERÁN TUS PRINCIPALES RESPONSABILIDADES?		- Designar los trabajos preventivos y correctivos que se van a realizar durante el día. según los materiales y mano de obra disponibles.	- Revisar y actualizar los formatos. programas. instructivos y procedimientos de forma anual.	- Brindar capacitación en seguridad y temas técnicos al personal de mantenimiento.,Tiempo Completo,Contrato por tiempo indefinido,500.00 US$ (Mensual),500,Jefe de Area Tecnica,mecanica de mantenimiento y refrigeracion,Servicios Generales. Aseo y Seguridad ,55,25,Universidad,1,Presencial,False,False,False,
797698EB8D6B2C3161373E686DCF3405,False,False,COMSERESTIB CLEANING MORALES &MORALES CIA. LTDA.,Ecuador,Quito,Pichincha,Ecuador,Almacén / Logística / Transporte,2024-08-08T14:11:54,2024-08-12T00:00:00,,,Español ,Realizar actividades de manipulación de mercancías durante las operaciones de carga. estiba. descarga. desestiba y transbordo de mercancías transportadas en bodegas. 	Capacidad para comunicar información de forma efectiva. 	,Por Horas,Contrato de obra o labor,450.00 US$ (Mensual),450,Estibador/a,Bachiller,Almacén / Logística / Transporte,29,18,Bachillerato / Educación Media,10,Presencial,False,False,True,
EE41933B292955DD61373E686DCF3405,False,False,Cendiavia C.L,Ecuador,Quito,Pichincha,Ecuador,Medicina / Salud,2024-08-08T14:11:55,2024-08-12T00:00:00,3,Comunicación y persuasión,Español ,Se busca médico radiólogo que brinde diagnóstico y trate diferentes condiciones médicas realizando ecos ultrasonidos y realizar informes de los mismos 	,Tiempo Completo,Otro tipo de contrato,A convenir,0,Medico Radiólogo,,Medicina / Salud,,,Postgrado,2,Presencial,False,False,True,
721316105770541261373E686DCF3405,False,False,Club Los Chillos,Ecuador,Rumiñahui,Pichincha,Ecuador,Ingeniería,2024-08-08T14:11:55,2024-08-13T00:00:00,2,Adobe Photoshop,,Importante Empresa Social Cultural y Deportiva. requiere contratar un Analista de mercadeo y/o tecnología.		Requisitos:		•	Título de tercer nivel en Ingeniería Sistemas. y tecnología en marketing 		•	Conocimientos en marketing		Funciones:		•	Mantenimiento preventivo y correctivo Software y Hardware	•	Soporte a Usuarios software y hardware	•	Conocimientos de las TIC – Redes. servidores. base de datos	•	Informática	•	Manejo Redes sociales	•	Reparación equipos de computación	•	Manejo herramientas multimedia	•	Marketing digital community manager comunicación	•	Adm. Campañas de marketing digital adm Redes sociales presentación de Servicios a Clientes		Condiciones contractuales:		•	Contrato  Tiempo Completo	•	Renta Bruta: Sueldo a convenir 	•	Horario Fijo		Capacitación e inducción	Dirección de Domicilio:	Que viva en el Valle de los Chillos de preferencia ( no excluyente)		,Tiempo Completo,Contrato por tiempo indefinido,A convenir,0,Analista de mercadeo y tecnologia,Analista de mercadeo y tecnologia,Ingeniería,35,25,Universidad,1,Presencial,False,False,False,4.3
46EBBF6243E9F73661373E686DCF3405,False,False,BROKERSOTER GLOBAL INSURANCE INTERMEDIARIA DE REASEGUROS S.A.,Ecuador,Quito,Pichincha,Ecuador,Ventas,2024-08-08T14:11:55,2024-08-15T00:00:00,1,Ventas,,Asesor Comercial de Seguros	Función:	Asesoría y comercialización de Seguros	Requisitos:	Conocimientos en seguros o aseguradoras	Experiencia mínima 2 años en: 	Medicina prepagada	Seguros de vida	Ramos generales	Excelente actitud y carisma	Beneficios:	Sueldo + Beneficios de Ley	Comisiones	Capacitación Constante 		Lugar: Quito. Sector la Carolina,Tiempo Completo,Contrato por tiempo indefinido,500.00 US$ (Mensual),500,Asesor,Seguros Salud. Vida. Ramos Generales,Ventas,0,18,Bachillerato / Educación Media,2,Presencial,False,False,True,
B5B3500B9520F05861373E686DCF3405,False,False,EAGLESECURITY COMPAÑIA LIMITADA,Ecuador,Quito,Pichincha,Ecuador,Servicios Generales. Aseo y Seguridad ,2024-08-08T11:41:14,2024-08-11T00:00:00,2,Atención al cliente. Gestión de ventas. Liderazgo. Promoción. Resolución de conflictos. Servicio al cliente. Ventas. Logística,,Descripción del Cargo:		Estamos en la búsqueda de una experta en Ventas autónoma y altamente proactiva para liderar nuestras actividades comerciales. Este rol es clave en nuestra empresa. ya que la candidata seleccionada será responsable de todo el proceso de ventas. desde la identificación de clientes potenciales hasta la gestión de la relación con los mismos. La posición se enfoca en la comercialización de servicios de seguridad y limpieza.		Responsabilidades:		    Desarrollar y ejecutar estrategias de ventas para promover y vender nuestros servicios de seguridad y limpieza.	    Identificar. contactar y captar nuevos clientes de manera independiente.	    Preparar y presentar propuestas comerciales. cotizaciones y contratos.	    Gestionar todo el ciclo de ventas. desde la prospección hasta el cierre de la venta.	    Realizar el seguimiento continuo de clientes actuales para asegurar su satisfacción y fomentar la repetición de negocios.	    Mantener actualizada la base de datos de clientes y registrar todas las actividades de ventas.	    Elaborar informes de ventas detallados y reportar directamente a la gerencia.	   		Requisitos:		    Experiencia comprobada en ventas. preferiblemente en los sectores de seguridad y limpieza.	    Capacidad para trabajar de manera independiente y tomar decisiones.	    Excelentes habilidades de comunicación y negociación.	    Fuertes habilidades organizativas y capacidad para manejar múltiples tareas simultáneamente.	    Enfoque orientado a resultados y capacidad para cumplir metas de ventas.		Ofrecemos:		    Salario básico con todos los beneficios por ley y comisiones.	    Oportunidades de crecimiento profesional dentro de la empresa.	    Un entorno de trabajo dinámico. con la libertad de liderar el proceso de ventas.		,Tiempo Completo,Contrato de obra o labor,450.00 US$ (Mensual),450,Agente de ventas,dia,Servicios Generales. Aseo y Seguridad ,26,23,Bachillerato / Educación Media,1,Presencial,False,False,False,
