id,cambioResidencia,viajar,empresa,paisEmpresa,ciudad,provincia,pais,areaName,fechaHoraPublicacion,fechaHoraVence,experienciaAnos,skills,idiomas,descripcion,tipoTrabajo,tipoContrato,salarioDescripcion,salario,titulo,descripcionTitulo,categoria,edadMaxima,edadMinima,educacionMinima,cantidadVacante,modalidadTrabajo,empresaVerificada,anuncioRelevante,aptoDiscapacitado,promedioEmpresa
8AF5D0A8C70DE39F61373E686DCF3405,False,False,,Ecuador,Quito,Pichincha,Ecuador,CallCenter / Telemercadeo,2024-09-11T20:16:43,2024-09-16T00:00:00,-1,,,Estamos en la búsqueda de Ejecutivos de Ventas por Call Center para unirse a nuestro equipo en Quito. Ecuador. En esta posición. serás responsable de realizar ventas a través de llamadas telefónicas. brindando un servicio de calidad y asesoramiento a nuestros clientes.		PERFIL SOLICITADO	Edad hasta 28 años	Bachiller o carreras administrativas 	Residencia Quito		EXPERIENCIA: Mínimo de 6 meses en el área de ventas por Call Center.		COMPETENCIAS:	Proactividad	Trabajo en equipo	Planificación y organización	Excelente expresión oral	Trabajo bajo presión	Responsable y puntual	CONOCIMIENTOS: Manejo de teclado. dominio intermedio de Excel y Office.		FUNCIONES A DESEMPEÑAR:	Manejo del proceso de ventas	Negociaciones	Cierre de ventas	Elaboraciones de reporte de ventas realizadas		OFERTA LABORAL: Excelente sueldo + comisiones,Tiempo Completo,Otro tipo de contrato,A convenir,0,Ejecutivo Ventas Call Center,,CallCenter / Telemercadeo,28,20,Bachillerato / Educación Media,50,Presencial,False,True,False,
B9C2AEE822A2499861373E686DCF3405,False,False,,Ecuador,Quito,Pichincha,Ecuador,CallCenter / Telemercadeo,2024-09-11T20:16:29,2024-09-16T00:00:00,-1,,Portugués ,Estamos en la búsqueda de Asesores de Ventas para Call Center. con dominio del idioma Portugués para unirse a nuestro equipo en Quito. Ecuador. En esta posición. serás responsable de realizar ventas a través de llamadas telefónicas. brindando un servicio de calidad y asesoramiento a nuestros clientes.		PERFIL SOLICITADO	Edad hasta 28 años	Bachiller o carreras administrativas 	Idioma Portugués Intermedio-Avanzado	Residencia Quito		EXPERIENCIA: Mínimo de 6 meses en el área de ventas por Call Center.		COMPETENCIAS:	Proactividad	Trabajo en equipo	Planificación y organización	Excelente expresión oral	Trabajo bajo presión	Responsable y puntual	CONOCIMIENTOS: Manejo de teclado. dominio intermedio de Excel y Office.		FUNCIONES A DESEMPEÑAR:	Manejo del proceso de ventas	Negociaciones	Cierre de ventas	Elaboraciones de reporte de ventas realizadas		OFERTA LABORAL: Excelente sueldo + comisiones,Tiempo Completo,Otro tipo de contrato,800.00 US$ (Mensual),800,Teleoperadores Idioma Portugués,,CallCenter / Telemercadeo,28,20,Bachillerato / Educación Media,20,Presencial,False,True,False,
127AF814C0B4038E61373E686DCF3405,False,False,KEMPERY WORLD TRAVEL S.A.,Ecuador,Quito,Pichincha,Ecuador,CallCenter / Telemercadeo,2024-09-11T17:39:07,2024-09-11T17:39:07,,Atención al cliente. Call Center. Calidad,,La aplicante es para el área de telemercadeo cuya fusión es hacer llamadas telefónicas para gestionar citas. (No es venta directa por teléfono). El trabajo es hacer que asistan clientes potenciales a un espacio comercial. donde otro departamento los atiende. La efectividad se mide por los clientes potenciales que hagamos llegar al destino. Aplicamos para medio tiempo y tiempo completo. ,Tiempo Completo,Otro tipo de contrato,A convenir,0,Agente de atención al cliente,call center,CallCenter / Telemercadeo,35,18,Bachillerato / Educación Media,5,Presencial,False,False,True,
B32A7E60643CD5C661373E686DCF3405,False,False,AROUND THE WORLD ECUADOR,Ecuador,Quito,Pichincha,Ecuador,Ventas,2024-09-11T17:34:47,2024-09-16T00:00:00,2,CRM. Comunicación y persuasión. Gestión de ventas. Microsoft Office,,Buscamos profesional en Turismo con experiencia mínimo de 2 años comprobada en Ventas telefónicas/presencial de intangibles.		El trabajo consiste en llamar vía telefónica para PROSPECTAR. HACER SEGUIMIENTO Y CIERRE. a los prospectos clientes que escriben por nuestra publicidad que hacemos como empresa en las diferentes redes sociales.		CARACTERÍSTICAS DEL PERFIL	* Excelente presencia y facilidad de palabra. 	* Persona pro activa. dispuesta a trabajar bajo presión con cumplimento de metas. 	* Atención personalizada al cliente vía telefónica. presencial. WhatsApp y CRM de la empresa. 	* Alta efectividad en cierre de ventas. 	* Ofrecer todos los servicios turísticos nacionales e internacionales de la agencia. 	* Asesoramiento completo en viajes y visados. 	* Realizar emisiones de pasajes aéreos y cotizaciones de tours. hoteles. cruceros. seguros de viajes. renta de autos. etc. 	* Dar un seguimiento diario a todos los clientes. 	* Realizar hojas de reserva y facturación. 	* Incrementar la cartera de clientes de la empresa. 	* Cumplir metas mensuales. 		OFRECEMOS	* Excelente ambiente de trabajo.	* Crecimiento dentro de la empresa.	* Se ofrece bonos económicos por cumplimiento. 	* El horario de trabajo es de lunes a sábado de 9:00 a 18:00. trabajamos fines de semana y feriados. 	* Sueldo $600.00 con beneficios de ley. más comisiones y bonificaciones. Ingresos promedio $800.00 a $1500.00		,Tiempo Completo,Contrato por tiempo indefinido,600.00 US$ (Mensual),600,Asesor/a comercial agencia de viajes,Tiempo completo. con experiencia,Ventas,42,23,Universidad,3,Presencial,True,False,False,3.6
C6E8E62B1B85546E61373E686DCF3405,False,False,,Ecuador,Quito,Pichincha,Ecuador,Recursos Humanos,2024-09-11T17:31:52,2024-09-11T17:31:52,2,Comunicación y persuasión. Liderazgo. Trabajo en equipo,,Somos una organización global que promueve la educación en línea. inspirada en el desarrollo de la sociedad a través de nuevos modelos de aprendizaje.	S4L sirve a sus instituciones afiliadas ayudándolas a maximizar su impacto a través de la transformación digital.		Funciones: 	* Atender y monitorear los casos de salud de los trabajadores de la empresa.	* Coordinar y realizar visitas domiciliarias.	* Monitorear la programación de exámenes médicos ocupacionales de manera mensual. según la programación anual.	* Promover convenios corporativos para beneficio del colaborador.	* Socializar y promover las actividades de bienestar y recreación realizadas por la empresa.	* Controlar y gestionar el cumplimiento de las actividades planificadas en el programa de SST y salud ocupacional de la organización		Requisitos indispensables: 	* Título de tercer nivel en Trabajo social o carreras afines. 	* Experiencia de 2 años en cargos semejantes.	* Conocimientos nivel intermedio en Microsoft Office y Google Sheet.	* Residir en Quito		Beneficios: 	* Modalidad de trabajo Híbrida	* Beca del 100% de estudios (tercer y cuarto nivel)	* Buen ambiente laboral,Tiempo Completo,Otro tipo de contrato,A convenir,0,Trabajador/a Social,Quito / Híbrido,Recursos Humanos,,,Universidad,1,Híbrido,False,True,False,
7CA219893A282DF861373E686DCF3405,False,False,GN Comunicación Inteligente,Ecuador,Quito,Pichincha,Ecuador,CallCenter / Telemercadeo,2024-09-11T16:20:01,2024-09-17T00:00:00,1,Liderazgo. Marketing. Servicio al cliente,Español ,¡Únete a nuestro equipo y lleva tu carrera al siguiente nivel!		¿Eres una persona apasionada por las ventas y el contacto con clientes? ¿Te motivan los desafíos y el logro de objetivos? Si además tienes experiencia en marketing digital y ventas a través de redes sociales. ¡esta oportunidad es para ti! Estamos en la búsqueda de Asesores Comerciales dinámicos y con ganas de crecer profesionalmente para formar parte de nuestro equipo.		Principales Responsabilidades:		-Realizar llamadas a potenciales clientes para la venta de PLANES TELEFÓNICOS.	-Identificar oportunidades de negocio y generar ventas efectivas.	-Asesorar a los clientes sobre nuestros planes de telefonía móvil. ofreciendo soluciones adaptadas a sus necesidades.	-Implementar estrategias de marketing digital y ventas en redes sociales para maximizar el alcance y la efectividad.	-Cumplir con las metas de ventas establecidas por la empresa.	Requisitos:		-Experiencia mínima de 1 año en ventas de intangibles (deseable. pero no excluyente).	-Experiencia en marketing digital y ventas a través de redes sociales.	-Excelentes habilidades de comunicación y negociación.	-Proactividad y orientación a resultados.	-Capacidad para trabajar en equipo y bajo presión.	-Disponibilidad para trabajar en horario completo.	Ofrecemos:		-Salario base con comisiones y bonos atractivos por cumplimiento de metas.	-Capacitación continua y oportunidades de desarrollo profesional en ventas y marketing digital.	-Excelente ambiente de trabajo.	¡No pierdas esta oportunidad de crecer con nosotros! Aplica ahora y forma parte de un equipo que valora tu talento y experiencia.,Tiempo Completo,Otro tipo de contrato,600.00 US$ (Mensual),600,Asesores Comerciales Quito,Distribuidor Autorizado de Claro,CallCenter / Telemercadeo,37,20,Bachillerato / Educación Media,2,Presencial,False,False,True,
75228A69110B3DC561373E686DCF3405,False,False,MARKETPRO,Ecuador,Quito,Pichincha,Ecuador,Ventas,2024-09-11T15:59:40,2024-09-11T15:59:40,3,,,ENVIAR CAPTURA DEL AVISO Y H0JA DE VlDA AL WHATSAPP DEL LOGO. No abrimos hojas de vida en CT y tampoco contestamos si no envia lo pedido.		Busco chica menor a 25 años trabajadora. honesta y creativa		Carismática. don de gentes. excelente expresión		Experiencia en ventas en canales tradicionales y canales digitales		Conocimiento de manejo de canales digitales (faceobnok. tiktok. instagram. CAPCUT. CANVA)		EL PUESTO ES PARA UNA VENDEDORA. no abogado. no ingeniero. no enfermera. SOLO VENDEDORAS	------------------------	Su trabajo será ejecutar el proceso de VENTAS de productos y servicios a través de diversos canales tradicioales y digitales	Visitas en frio a clientes (ventas de campo)	PREFERIBLE CON CARTERA DE CLIENTES	Preferible conocer sector automotriz 	----------------------------------		Que viva en Quito o Guayaquil o Manta o Coca ,Tiempo Completo,Otro tipo de contrato,A convenir,0,Vendedora de campo con experiencia en ventas y marketing tradicional y digital,Aplicar solo vendedorAs con experiencia,Ventas,,,Educación Técnico/Profesional,1,Híbrido,False,False,False,
7469A79748F7E4FA61373E686DCF3405,False,True,"ASOCIACIÓN DE PRODUCCIÓN TEXTIL CIERRE DORADO ""ASOPROTEXCIEDO""",Ecuador,Quito,Pichincha,Ecuador,Administración / Oficina,2024-09-11T15:44:13,2024-09-11T15:44:13,,Software de Contabilidade. Capacidad de decisión. Gestión de ventas. Administración. Microsoft Office,,Contrato especialista en gerencia. toma de decisiones y gestión documental. con manejo de Microsoft Office para asistir en labores administrativas. y de contabilidad media.,Tiempo Completo,Contrato por tiempo indefinido,502.00 US$ (Mensual),502,Asistente de gerencia,Hábil para tomar decisiones,Administración / Oficina,30,17,Educación Básica Secundaria,2,Híbrido,False,False,False,
5C2C60975C138E3561373E686DCF3405,False,False,,Ecuador,Quito,Pichincha,Ecuador,Investigación y Calidad,2024-09-11T13:30:02,2024-12-30T00:00:00,3,,,Asesorar. direccionar y concretar ventas de los servicios del hospital enfocado en  la comercialización paquetes de salud tanto a clientes particulares como de seguros privados. además del seguimiento en cuanto al cumplimiento de la calidad del servicio.,Tiempo Completo,Contrato por tiempo indefinido,1.500.00 US$ (Mensual),1500,Especialista Comercial,Comercial,Investigación y Calidad,57,38,Universidad,1,Presencial,False,True,True,
94C2272294CD2DA561373E686DCF3405,False,False,Ditelcom SA,Ecuador,Quito,Pichincha,Ecuador,Ventas,2024-09-05T15:19:27,2024-09-15T00:00:00,4,CRM. Gestión de ventas,,Oficina Comercial en Quito. desea estructurar su nuevo equipo  de ventas Consultivas. para lo cual desea contratar 4 ejecutivas de ventas intangibles y servicios.		Indispensable experiencia en venta de Seguros. planes celulares empresas o ventas Pyme		Actividades:	Construir un CRM de prospectos 	Contar con base de clientes propia	agendamiento de 5 citas semanales y 5 virtuales 	Alta orientación a Resultado y manejo optimo de técnicas de Cierre 		Empresa ofrece 	Equipo de computación y linea celular	Sueldo básico mas esquema comisional sobre los 400 usd  	Beneficios de ley a partir del 3 mes de prueba ,Tiempo Completo,Contrato por tiempo indefinido,600.00 US$ (Mensual),600,Ejecutivo/a comercial,Con experiencia venta planes celulares empresas,Ventas,30,25,Universidad,4,Presencial,False,False,True,
A7240B5DA4BC34C461373E686DCF3405,False,True,WEBCOOPEC SYSTEM CIA.LTDA.,Ecuador,Rumiñahui,Pichincha,Ecuador,Informática / Telecomunicaciones,2024-09-11T12:26:26,2024-09-15T00:00:00,2,Administración,Inglés ,Conocimiento de ofimática. bases de datos.	Excelentes habilidades de comunicación escrita y oral	Dominio avanzado de herrameintas de software de escritorio	Capacidad para gestionar tares. proyectos y docuemntación	Habilidad para resolver problemas. trabajar en equipo. y manetener confidencialidad. trabajo bajo presión.,Tiempo Completo,Contrato por tiempo indefinido,600.00 US$ (Mensual),600,Asistente de gerencia,tercer nivel,Informática / Telecomunicaciones,40,25,Universidad,2,Presencial,False,False,False,
1C863A7A8C55B70461373E686DCF3405,False,False,Favalle Cia Ltda.,Ecuador,Rumiñahui,Pichincha,Ecuador,Mantenimiento y Reparaciones Técnicas,2024-09-11T12:14:32,2024-09-30T00:00:00,3,Trabajo en equipo. Mantenimiento. Electrónica,,Industria papelera busca incorporar Técnico de Mantenimiento Eléctrico/Electrónico altamente capacitado. Proactivo. dinámico. con experiencia en mantenimiento preventivo y correctivo de equipos eléctricos y electrónicos (Convertidores de Velocidad. PLCs. Bombas. Compresores. Tableros. Motores Eléctricos. variadores de velocidad. servos motores. encoder). neumática.	Responsabilidades:	• Realizar diagnósticos y reparaciones de equipos eléctricos y electrónicos.	• Ejecutar mantenimiento preventivo para asegurar el correcto funcionamiento de los sistemas.	• Colaborar con otros departamentos para resolver problemas técnicos.	• Mantener registros detallados de las actividades de mantenimiento..	Aplicar personas que cumplan con el perfil solicitado. 	La empresa ofrece transporte. excelente ambiente de trabajo. alimentación y beneficios propios de ley	,Tiempo Completo,Contrato por tiempo indefinido,A convenir,0,Técnico de mantenimiento eléctrico/electrónico,Experiencia en maquinaria industrial,Mantenimiento y Reparaciones Técnicas,35,27,Educación Técnico/Profesional,1,Presencial,False,False,True,4.3
42142F01C6A5722F61373E686DCF3405,False,False,ECUA CONSORCIO CONSORCIODELECUADOR S.A.,Ecuador,Quito,Pichincha,Ecuador,Ventas,2024-09-11T12:07:16,2024-09-20T00:00:00,-1,Gestión de ventas. Asesoría comercial,Español ,	Conocimientos	•	Atención al cliente y manejo de objeciones	•	Planes de financiamiento programado	•	Técnicas y cierre de ventas	•	Prospección	•	Negociación y persuasión	•	Manejo de redes sociales		Principales actividades:	•	Realizar prospección de clientes	•	Oferta de planes de financiamiento programada para vehículos por redes sociales	•	Creación de base de datos	•	Entrevista con clientes	•	Cierre de ventas y firma de contratos 	•	Asistir a puntos de ventas	•	Dar seguimiento post- venta a los clientes 	•	Entregar contratos de ventas a supervisores	•	Cumplir y superar los objetivos de ventas. que le sean asignados.			Requisitos:	• Bachiller	• Experiencia mínima de 1 año en venta de intangibles.	• Disponibilidad de trabajar de forma presencial en jornada completa		Beneficios	•	Pago sueldo	•	Pago de comisiones	•	Bonificaciones	•	Chip empresarial,Tiempo Completo,Contrato por tiempo determinado,A convenir,0,Asesor comerrcial,sur de Quito,Ventas,,,Bachillerato / Educación Media,4,Presencial,False,False,True,
473496BCB67548EA61373E686DCF3405,False,False,NEXTI BUSINESS SOLUTIONS,Ecuador,Quito,Pichincha,Ecuador,Recursos Humanos,2024-09-11T12:07:16,2024-09-30T00:00:00,3,Comunicación y persuasión,,Trabajo presencial en la ciudad de Quito	La principales funciones serán:	Reclutamiento y Selección de personal de tecnología	Entrevsitas a candidatos 	Prefiltro de candidatos	Coordinar entrevistas	Seguimiento de procesos de selección	Tareas administrativas varias que se requieran	Envío y recepción de corresos electrónicos,Tiempo Completo,Contrato por tiempo indefinido,A convenir,0,Asistente,Talento Humano,Recursos Humanos,0,26,Universidad,2,Presencial,False,False,False,
8C2A74283BBC1A2C61373E686DCF3405,False,False,EDUCOLLEGE,Ecuador,Quito,Pichincha,Ecuador,CallCenter / Telemercadeo,2024-09-11T12:07:16,2024-09-13T00:00:00,1,Asesoría comercial,,El contrato de trabajo (Tiempo indefinido) que se realizaría es para: TELETRABAJO Teleoperador de CALL CENTER		Salario mínimo vital para teleoperadores de call center: 499.00 mensuales netos con los décimos mensualizados.		El salario es FIJO	El horario de trabajo es de lunes a viernes de 8:30 a 12:30 y de 17:30 a 21:30 (Horarios sujeto a modificaciones) y los sábados es de 8:00 a 12:00		La empresa Brinda ESTABILIDAD. CAPACITACIÖN constante y oportunidad de CRECIMIENTO		os requisitos necesarios para ingresar en el proceso de selección.		1. Tener un espacio adecuado para trabajar en teletrabajo.	2. Computadora propia con windows.	3. Conexión a internet con 20 mg mínimo dedicado para el trabajo (No se acepta conexión con CNT).	4. Audífonos con micrófono o diadema para la computadora.		Los horarios de las capacitaciones y entrenamiento son de 8:00 a 12:30 en la mañana y de 16:00 a 21:30 en la tarde noche		Los aspirantes deberán asistir los dos horarios		Este proceso de selección *No tiene COSTO* para los aspirantes.		,Tiempo Completo,Contrato por tiempo determinado,450.00 US$ (Mensual),450,Agente de atención al cliente Call center,Teletrabajo,CallCenter / Telemercadeo,45,19,Bachillerato / Educación Media,10,Remoto,True,False,False,
AE9DD2E09008C94C61373E686DCF3405,False,True,Cartonera Pichincha,Ecuador,Quito,Pichincha,Ecuador,Ventas,2024-09-11T12:07:16,2024-09-11T12:07:16,2,,,Estamos buscando una Asesora Comercial que pueda fortalecer nuestro equipo con habilidades en ventas y atención al cliente. Esta posición requiere movilización propia. ya que la candidata seleccionada será responsable de visitar a nuestros clientes y gestionar nuevas oportunidades de negocio.		Responsabilidades:		Prospección de Clientes: Identificar y captar nuevas oportunidades de negocio.	Asesoramiento Personalizado: Ofrecer una atención y asesoría de alta calidad sobre nuestros productos y servicios.	Presentaciones y Demostraciones: Realizar presentaciones efectivas y demostraciones de productos.	Negociación y Cierre: Negociar términos y cerrar contratos de venta con éxito.	Seguimiento y Fidelización: Mantener una relación cercana con los clientes para asegurar su satisfacción y fidelidad.		Requisitos:		Experiencia previa en ventas 	Responsable. proactiva y comprometida con su trabajo	Excelentes habilidades de comunicación y capacidad de negociación.	Orientación al cliente y habilidades para resolver problemas.	Movilización propia. ,Tiempo Completo,Contrato por tiempo indefinido,A convenir,0,Asesora comercial,con experiencia,Ventas,,,Educación Técnico/Profesional,1,Presencial,False,False,False,4.3
D9DFE6CC168196D461373E686DCF3405,False,False,VELASTEGUI SANDOVAL ANIBAL RAFAEL,Ecuador,Quito,Pichincha,Ecuador,Docencia,2024-09-11T12:07:17,2024-09-16T00:00:00,2,Creatividad. Enseñanza. Formación. Gestión de las emociones. Iniciativa. Innovación. Liderazgo. Planificación. Presentaciones. Pedagogía. Docencia. Microsoft Office,Español .Inglés ,Institución Educativa ubicada al norte de Quito. requiere incorporar a su equipo de trabajo un docente para el área de matemáticas y física (Bachillerato). 	Con experiencia minima de 2 años. título de tercer nivel/cuarto nivel en el campo educativo. 		,Tiempo Completo,Otro tipo de contrato,A convenir,0,Profesor asignatura,Experiencia,Docencia,55,30,Universidad,1,Presencial,False,False,False,
837ABDB41E7BD95A61373E686DCF3405,False,False,STAMPA PRODUCCIONES,Ecuador,Quito,Pichincha,Ecuador,Ventas,2024-09-11T12:07:17,2024-10-01T00:00:00,3,Aceptación de errores y fracasos. Análisis. Comunicación y persuasión. Gestión de ventas. Gestión del Tiempo. Negociación. Servicio al cliente. Asesoría comercial,,DESCRIPCION DE LA OFERTA	Empresa del sector grafico requiere contratar vendedora.		MISION DEL CARGO	Persona encargada de contribuir activamente en el departamento comercial impulsando las ventas y crear nuevas oportunidades de negocio.		PERFIL	•	Bachiller de preferencia con estudios universitarios.	•	Mujeres edad entre 26-46 años.	•	Experiencia mínima en ventas 2 años. de preferencia en el área de artes gráficas y publicidad.	•	Disponibilidad para viajar (no indispensable)		RESPONSABILIDADES	•	Prospectar nuevos clientes.	•	Visitar a clientes potenciales para impulsar la venta de nuestros productos.	•	Responsable de informar semanalmente sobre ventas realizadas al Gerente Comercial.	•	Cumplir con el presupuesto del área.	•	Cierre de ventas con el objetivo de una relación comercial a largo plazo con los nuevos clientes.		COMPETENCIAS	•	Capacidad para generar nuevos negocios	•	Orientación de servicio	•	Enfoque en los resultados	•	Negociación y construcción de relaciones	•	Capacidad de análisis		BENEFICIOS	•	Sueldo fijo	•	Porcentaje de comisión competitiva	•	Beneficios de ley	•	Oportunidad de crecimiento profesional	,Tiempo Completo,Otro tipo de contrato,A convenir,0,Vendedora,,Ventas,46,26,Educación Técnico/Profesional,1,Presencial,False,False,True,
B01D353625A50CCB61373E686DCF3405,False,False,EXPORMODA CIA LTDA ,Ecuador,Quito,Pichincha,Ecuador,Contabilidad / Finanzas,2024-09-11T12:07:17,2024-09-15T00:00:00,2,,,Importante empresa dedicada a la fabricación y comercialización de prendas de vestir. necesita asistente contable y de nomina.		FUNCIONES PRINCIPALES	•	Ingreso facturas compras	•	Reembolsos de gastos.	•	Registro de Retenciones. bajo normativa vigente	•	Conciliar Bancos	•	Registro de Pagos	•	Elaborar borradores de Impuestos	•	Registros en el SUT Ministerio de Trabajo	•	Manejo de Super de Compañías	•	Manejo plataforma IESS	•	Realización de nómina y liquidaciones.	•	Análisis de cuentas del Balance	•	Conciliación de módulos		REQUISITOS		•	Título en Ing.. o Lcda. en Contabilidad y Auditoría	•	Experiencia como Asistente Contable mínimo 2 años.	•	De preferencia experiencia en outsourcing contable (no excluyente).	•	Conocimiento alto Microsoft Excel.	•	Experto en el uso de plataformas fiscales. regulatorias y laborales: SRI. Superintendencia de Compañías. IESS	•	Conocimiento de las herramientas del Office	•	Trabajo en equipo	•	Predisposición para aprender y trabajar bajo presión.	•	Disponibilidad inmediata para trabajar 8 horas. horario completo	•	Pensamiento analítico y razonamiento matemático.		Interesados enviar informacion a recursoshumanosarrobaexpormodapuntocom,Tiempo Completo,Contrato por tiempo indefinido,600.00 US$ (Mensual),600,Analista Contable y de Nomina,Empresa textil,Contabilidad / Finanzas,,,Universidad,1,Presencial,False,False,False,4.0
466CA4A710718F1061373E686DCF3405,False,False,Liberty Brigde Investments LBI S.A.S,Ecuador,Quito,Pichincha,Ecuador,Ventas,2024-09-11T12:07:17,2024-09-24T00:00:00,2,CRM. Comunicación y persuasión. Inmobiliaria. Negociación. Servicio al cliente,Español ,•	Prospectar y gestionar clientes potenciales mediante un seguimiento proactivo. liderando el proceso y cierre de negociaciones. desde la oferta inicial hasta la firma final. garantizando una experiencia excepcional para el cliente y el logro de los objetivos de venta establecidos.	•	Gestionar y administrar el ciclo del CRM.  	•	Brindar asesoramiento personalizado a clientes. comprendiendo sus necesidades y ofreciendo soluciones que se adapten a sus requerimientos.	•	Conocer el mercado y mantenerse al tanto de las tendencias actuales para proporcionar información valiosa a los clientes y a la empresa.	,Tiempo Completo,Otro tipo de contrato,A convenir,0,Asesor Inmobiliario,,Ventas,,,Educación Técnico/Profesional,1,Presencial,False,False,True,
1A32FB10A009D98D61373E686DCF3405,False,False,Liberty Brigde Investments LBI S.A.S,Ecuador,Quito,Pichincha,Ecuador,Ventas,2024-09-11T12:07:17,2024-09-24T00:00:00,3,CRM. Comunicación y persuasión. Negociación. Microsoft Office,Español ,•	Desarrollar e implementar estrategias de ventas efectivas para maximizar el rendimiento y alcanzar las metas establecidas.	•	Crear y mantener relaciones sólidas con clientes clave. comprendiendo sus necesidades y ofreciendo soluciones personalizadas.	•	Colaborar estrechamente con el equipo para optimizar procesos y asegurar el cumplimiento de objetivos.	•	Utilizar herramientas ofimáticas y CRM para gestionar y analizar datos de ventas. garantizando una administración eficiente del tiempo y recursos.	,Tiempo Completo,Otro tipo de contrato,A convenir,0,Gestor Senior,Venta de Intangibles,Ventas,,,Educación Técnico/Profesional,1,Presencial,False,False,True,
