cambioResidencia,viajar,empresa,ciudad,areaName,fechaHoraPublicacion,fechaPublicacion,experienciaAnos,skills,provincia,idiomas,descripcionTitulo,descripcion,tipoTrabajo,tipoContrato,salarioDescripcion,salario,titulo,edadMaxima,edadMinima,educacionMinima,cantidadVacante,modalidadTrabajo,empresaVerificada,anuncioRelevante,aptoDiscapacitado,promedioEmpresa
False,True,HOTELES DECAMERON ECUADOR S.A,Ecuador,Ventas,2024-08-15T16:51:38,,2,,Azuay,Inglés ,tour and travel Cuenca,Misión del cargo:	Ser responsable de promocionar y comercializar los servicios de hoteles Decameron a clientes corporativos o venta directa. valiéndose para ello de todas las herramientas de comunicación corporativa.		Formación:	Tecnología o ingeniería en hoteleria y turismo		,Tiempo Completo,Contrato por tiempo indefinido,760.00 US$ (Mensual),760,Ejecutivo ventas,40,25,Educación Técnico/Profesional,1,Presencial,False,False,False,
False,False,ESPINOZA DUTAN OSWALDO ARTURO,Ecuador,Construcción y obra,2024-08-15T09:49:00,,1,Resolución de problemas,Azuay,Español ,Con experiencia,1. Organizar y preparar el área de trabajo. asegurando que todos los materiales y herramientas estén limpios y en buen estado.	2. Ayudar en la medición. corte. lijado. masillado y ensamblaje de piezas de madera según las especificaciones del proyecto.	3. Utilizar herramientas manuales y eléctricas bajo la supervisión del carpintero principal.,Tiempo Completo,Contrato por tiempo determinado,460.00 US$ (Mensual),460,Oficial carpintero/a,35,18,Educación Básica Primaria,1,Presencial,False,False,False,
False,False,NARVAEZ GUAPISACA MARIA CRISTINA,Ecuador,Otros,2024-08-12T21:26:14,,1,Atención al cliente,Azuay,Español ,Con Experiencia,Habilidades y destreza para aplicar técnicas de manicure y pedicure.	Conocimiento en cuidado de las uñas. 	Creatividad y habilidad en crear diseños en las uñas	Servicio al cliente.	Capacidad de trabajar en equipo.	,Tiempo Completo,Otro tipo de contrato,A convenir,0,Manicurista,0,18,Bachillerato / Educación Media,2,Presencial,False,False,True,
False,False,SUMESA S. A.,Ecuador,Medicina / Salud,2024-08-12T19:41:27,,,,Azuay,,Con Experiencia,Asear y cuidar la higiene de los enfermos.	Brindar apoyo emocional y psicológico a los pacientes y a los familiares.	Administrar medicamentos a los pacientes vía oral. rectal y tópica.	Controlar la temperatura a los enfermos.	Preparar documentos de registro y citación.	Acompañar a los pacientes a la realización de pruebas. a sus habitaciones o a los lugares que se les hayan asignado.	Cambiar la ropa de cama y los pijamas de los pacientes ingresados.	Repartir la comida a los pacientes ingresados y ayudar a los que no puedan comer por sí solos.	Aplicar técnicas de primeros auxilios.,Tiempo Completo,Contrato por tiempo indefinido,1.200.00 US$ (Mensual),1200,Auxiliar de enfermería,50,19,Educación Técnico/Profesional,70,Presencial,False,False,True,
False,False,CORPORACIÓN PURIFICA ECUADOR CORPURIFICA S.A.,Ecuador,Ventas,2024-08-12T09:28:40,,1,Gestión de ventas,Azuay,,,"¡Únete a Carico Internacional como Asesor Comercial Independiente!		En Carico Internacional. estamos en la búsqueda de Asesores Comerciales Independientes con experiencia para formar parte de nuestro equipo. Si eres un profesional apasionado por las ventas y el servicio al cliente. esta es tu oportunidad de crecer y desarrollar tu carrera con nosotros.		¿Qué ofrecemos?		Crecimiento profesional: Desarrolla tus habilidades y alcanza tus metas empresariales con nuestro apoyo continuo.	Herramientas y capacitación: Accede a recursos que te ayudarán a ser exitoso en tu rol.	Ambiente de trabajo dinámico: Únete a un equipo motivado y enérgico. comprometido con la excelencia.	Requisitos imprescindibles:		Experiencia: Mínimo 2 años en venta directa o atención al cliente.	Habilidades: Excelente fluidez verbal. poder de negociación. iniciativa y actitud positiva.	Autonomía: Capacidad para trabajar de manera independiente y gestionar tu tiempo eficazmente.	Educación: Bachillerato en adelante.	Flexibilidad: Disponibilidad para viajar 	Perfil del candidato ideal:		Edad: Entre 18 y 50 años.	Conocimientos: adaptación al cambio. gestión de ventas y servicio al cliente.	Si cumples con estos requisitos y estás listo para unirte a una empresa que valora tu talento. envíanos tu hoja de vida con el asunto ""ASESOR/A COMERCIAL"".		¡Estamos deseando contar con tu talento en Carico Internacional!",Tiempo Completo,Otro tipo de contrato,460.00 US$ (Mensual),460,Asesores Comerciales Comisionistas,50,18,Bachillerato / Educación Media,5,Presencial,False,False,False,
False,False,Hito33,Ecuador,Diseño / Artes gráficas,2024-08-08T14:11:54,,1,Adobe Ilustrator. Adobe Photoshop. Adobe After Effects. Adobe Premier,Azuay,Español .Inglés ,Redes Sociales,Hola! Buscamos un diseñ@dor creativo. proactivo. actualizado en tendencias y sobretodo dispuesto a aprender :)		Crearás contenido estratégico para redes sociales; anuncios. posts y videos. 		Envíanos tu portafolio y cv.	,Tiempo Completo,Contrato de obra o labor,500.00 US$ (Mensual),500,Diseñador publicitario,,,Bachillerato / Educación Media,1,Presencial,False,False,True,
False,False,Autoatiempo S.A,Ecuador,Informática / Telecomunicaciones,2024-08-08T11:12:47,,5,,Azuay,Inglés ,,Reunir y documentar los requerimientos técnicos para nuevas integraciones y actualizaciones de las existentes.		Diseñar y desarrollar integraciones API entre diferentes servicios utilizados por el negocio		Diseñar. crear y modificar estructuras de bases de datos SQL según las necesidades del negocio.		Realizar tareas de mantenimiento regular en las tablas de datos para asegurar la integridad y la performance de las bases de datos.		Configurar e integrar servicios serverless y máquinas virtuales en AWS o Azure según los requerimientos del proyecto.		Implementar soluciones de monitorización y escalabilidad para asegurar que los servicios cloud estén siempre disponibles y puedan manejar incrementos en la carga de trabajo.		Configurar y gestionar servicios en AWS y/o Azure. incluyendo instancias EC2. Lambda. S3. RDS. entre otros.		Desarrollar y mantener aplicaciones móviles usando React Native.	Desarrollar y mantener aplicaciones backend utilizando Node JS.		Diagnosticar y resolver problemas técnicos reportados por los usuarios o detectados en los sistemas.		Proveer soporte técnico a los usuarios finales y a otros equipos internos cuando sea necesario.		Identificar oportunidades para optimizar procesos y flujos de trabajo existentes.		Mantener documentación técnica actualizada y crear nueva documentación según sea necesario para guiar a otros desarrolladores y equipos de soporte.,Tiempo Completo,Contrato por tiempo indefinido,650.00 US$ (Mensual),650,desarrollador de software,40,25,Universidad,1,Presencial,False,False,True,
False,False,PIZZERIAS PIATTOSANI CIA. LTDA.,Ecuador,Atención a clientes,2024-08-08T09:59:44,,1,Comunicación y persuasión. Resolución de problemas. Trabajo en equipo,Azuay,Español ,Turnos rotativos,- Ejecutar estrategias para atraer y retener a los clientes. 	- Excelentes habilidades de comunicación.	- Ofrecer un optimo servicio al cliente.	- Facturación y control de caja.			,Tiempo Completo,Contrato por tiempo indefinido,460.00 US$ (Mensual),460,Atención al cliente,,,Bachillerato / Educación Media,2,Presencial,False,False,False,
False,True,RunFood,Ecuador,Informática / Telecomunicaciones,2024-08-06T14:16:35,,1,Atención al cliente. Comunicación y persuasión. Gestión de ventas. Tecnología. Administración,Azuay,,con experiencia,Vender. orientar y asesorar a la clientela	Atiende a los clientes potenciales.	Hace negociaciones.	Genera relaciones positivas.	Cierra ventas.	Capacitación a clientes	Realiza informes.,Tiempo Completo,Otro tipo de contrato,500.00 US$ (Mensual),500,Agente comercial,45,24,Educación Básica Secundaria,1,,False,False,False,
False,False,BESTBRIAN CIA.LTDA.,Ecuador,Atención a clientes,2024-08-05T16:30:53,,1,,Azuay,,contratación inmediata,Responsabilidades:	Atender y solventar dudas de clientes internos	Agendar citas con los clientes para brindarles atención personalizada	Proveer un excelente servicio y atención a nuestros clientes	Mantener una comunicación clara y efectiva con los clientes	Manejar una agenda de citas con clientes internos		Requisitos: 	Sexo femenino	Edad: 23 a 35 años	Experiencia comprobable en el área de servicio al cliente	Excelentes habilidades de comunicación y expresión oral	Facilidad de palabra	Trato amable y profesional al cliente	Capacidad para resolver dudas y brindar soluciones efectivas	Excelente presencia.		Ofrecemos:	Salario competitivo	Ambiente de trabajo profesional y dinámico	Oportunidades de crecimiento y desarrollo profesional		¡Te esperamos para que formes parte de nuestra empresa y contribuyas a brindar el mejor servicio a nuestros clientes!,Tiempo Completo,Contrato por tiempo indefinido,A convenir,0,Ejecutiva de servicio al cliente,35,22,Educación Técnico/Profesional,1,Presencial,False,False,False,
False,False,BESTBRIAN CIA.LTDA.,Ecuador,Mercadotecnia / Publicidad / Comunicación,2024-08-05T16:30:53,,-1,,Azuay,,contatación inmediata,Estamos en busca de un/a Especialista en Remarketing para unirse a nuestro dinámico equipo.	Responsabilidades:	•  Programar y coordinar citas entre clientes y personal de ventas.	•  Realizar seguimientos proactivos	•  Trabajar bajo procesos establecidos para asegurar la eficiencia y efectividad.	• Colaborar con el equipo de ventas para mejorar continuamente los procesos de coordinación y seguimiento.	Requisitos:	•  Excelentes habilidades de comunicación verbal y escrita.	•  Capacidad para trabajar de manera autónoma y en equipo.	•  Fuerte orientación al cliente y habilidades interpersonales.	•  Capacidad para gestionar múltiples tareas y prioridades.	•  Conocimiento en herramientas de marketing digital y CRM.		Ofrecemos:	•	Un entorno de trabajo dinámico y colaborativo.	•	Oportunidades de desarrollo profesional.	•	Sueldo básico + comisiones	,Tiempo Completo,Contrato por tiempo indefinido,450.00 US$ (Mensual),450,Especialista en Remarketing,35,25,Educación Técnico/Profesional,1,Presencial,False,False,False,
False,False,Cargotrack,Ecuador,Informática / Telecomunicaciones,2024-08-05T16:30:53,,5,ASP.Net. CSS. HTML. Java. JavaScript. PHP. Servidores de E-mail. Servidores Web. Apache Avro. Apache Drill. AngularJS. ASP.NET MVC Web API. ASP.NET MVC. HTML 5. WordPress. MySql,Azuay,Inglés ,Full Stack Semi senior Senior Developers,¿Deseas trabajar y desarrollar proyectos web y sistemas atractivos?		¡Únete a nuestro equipo!		Estamos buscando un webmaster - desarrollador/programador web que le apasione los retos y las nuevas tecnologías de desarrollo y optimización.	Si tienes experiencia demostrable en el desarrollo web y de sistemas. esta oferta de trabajo es para ti.		Requisitos:		Experiencia demostrable como desarrollador/programador web.	Conocimiento profundo de lenguajes de programación como HTML. CSS. JavaScript.	Experiencia en el desarrollo de sitios web responsivos.	Familiaridad con frameworks y bibliotecas modernas como React. Angular o Vue.	Capacidad para colaborar eficientemente en un entorno de equipo.	Habilidades de resolución de problemas y atención al detalle.	Responsabilidades:		Desarrollar y mantener aplicaciones web de alto rendimiento.	Crear y gestionar un equipo de desarrolladores	Colaborar con el equipo para diseñar y lanzar nuevas funcionalidades.	Garantizar la calidad y eficiencia del código.	Mantenerse actualizado con las últimas tendencias y tecnologías en desarrollo web.	Ofrecemos:		Un ambiente de trabajo colaborativo y creativo.	Oportunidades de crecimiento profesional y desarrollo.	Proyectos emocionantes que desafiarán y expandirán tus habilidades.	Remuneración competitiva acorde a tu experiencia y habilidades.	Si estás listo para dar el siguiente paso en tu carrera como desarrollador web y cumples con los requisitos mencionados. ¡esperamos tu aplicación! Envía tu currículum y ejemplos de proyectos anteriores que demuestren tu experiencia.		¡Únete a nosotros y sé parte de proyectos con gran futuro y de gran demanda!,Tiempo Completo,Contrato por tiempo indefinido,A convenir,0,Desarrollador/a web,,,Universidad,1,Presencial,False,False,False,
False,True,PARRA TRELLES MAYRA GABRIELA,Azuay,Ventas,2024-07-30T15:15:15,,2,,Azuay,,Vendedora on line,Ventas On Line 	Comunicacion eficaz con el cliente	Experiencia en ventas on line	Conocimientios en entregas y verificacion de pagos	Proactiva	Capacidad de trabajar bajo presion	Trabajo en equipo	Disponibilidad para viajar,Tiempo Completo,Otro tipo de contrato,A convenir,0,Vendedora On Line,45,23,Bachillerato / Educación Media,1,Presencial,False,False,True,
False,False,CUENCALICOR CIA. LTDA. ,Ecuador,Almacén / Logística / Transporte,2024-07-29T16:58:05,,3,,Azuay,,Ayudante,- RESIDIR EN CUENCA 	- Licencia profesional.	- Con 3  o más años de experiencia comprobable en manejo de camiones.  despacho.  estiba  y entrega de mercadería al cliente.	- Con conocimiento vial  para  movilizarse en toda  la provincia del Azuay.	- Con disponibilidad inmediata.	,Tiempo Completo,Contrato por tiempo indefinido,A convenir,0,Chofer Despachador,35,0,Bachillerato / Educación Media,2,Presencial,False,False,False,4.0
False,False,BESTBRIAN CIA.LTDA.,Ecuador,Otros,2024-07-26T13:06:07,,1,Adobe Ilustrator. Adobe Photoshop. Adobe After Effects. Adobe Premier,Azuay,,con experiencia,Formación: Título universitario o técnico en Comunicación Audiovisual. Cine. Producción Multimedia o carrera afín.	Dominio de Software:	Edición: Adobe Premiere Pro. Final Cut Pro o software similar.	Diseño Gráfico: Adobe After Effects. Photoshop. Illustrator.	Creatividad: Capacidad para generar ideas originales y atractivas. adaptadas a un público educativo.	Habilidades de Escritura: Dominio de la escritura de guiones. tanto para videos explicativos como narrativos.	Adaptabilidad: Disposición para trabajar en diferentes formatos y estilos de video. según las necesidades del proyecto.	Organización: Capacidad para gestionar múltiples proyectos simultáneamente y cumplir con los plazos establecidos.	Habilidades de Comunicación: Capacidad para trabajar en equipo y comunicarse de manera efectiva.,Tiempo Completo,Contrato por tiempo indefinido,A convenir,0,Productor audiovisual,35,25,Educación Técnico/Profesional,1,Presencial,False,False,False,
False,False,Kamaytech,Ecuador,Informática / Telecomunicaciones,2024-07-25T11:52:14,,1,,Azuay,,,Descripción del Puesto:		En Kamaytech. estamos buscando un desarrollador backend con experiencia en Node.js para unirse a nuestro equipo de manera presencial. Si te apasiona el desarrollo de software y quieres trabajar en un entorno dinámico y en constante evolución. esta es tu oportunidad.		Responsabilidades:			•	Desarrollar y mantener aplicaciones backend utilizando Node.js y Express.		•	Diseñar y administrar bases de datos relacionales utilizando PostgreSQL.		•	Colaborar con otros desarrolladores para integrar las soluciones backend.		•	Escribir código limpio. bien documentado y escalable.		•	Participar en la revisión de código y en la resolución de problemas técnicos.		•	Investigar nuevas tecnologías y herramientas que puedan mejorar la calidad del código y la eficiencia del desarrollo.		Requisitos:			•	Experiencia en desarrollo con Node.js y Express.		•	Conocimiento y experiencia en el diseño y administración de bases de datos relacionales. específicamente PostgreSQL.		•	Experiencia en la creación y consumo de APIs RESTful.		•	Capacidad para trabajar en equipo y comunicarse efectivamente.		•	Capacidad para trabajar en un entorno ágil y adaptable.		•	Pasión por el desarrollo de software y el aprendizaje continuo.		Ofrecemos:			•	Un entorno de trabajo colaborativo y de apoyo.		•	Un equipo experimentado y dedicado que te ayudará a crecer como desarrollador.		•	Oportunidades para trabajar en proyectos emocionantes y de vanguardia.		•	Desarrollo profesional continuo y oportunidades de aprendizaje.		•	Flexibilidad laboral y equilibrio entre la vida laboral y personal.,Tiempo Completo,Contrato por tiempo indefinido,A convenir,0,Desarrollador backend nodejs,0,18,Universidad,1,Presencial,False,False,False,
False,False,Kamaytech,Ecuador,Informática / Telecomunicaciones,2024-07-25T11:52:14,,1,,Azuay,,,Descripción del Puesto:		En Kamaytech. estamos buscando una persona para el puesto de Soporte de Software que tenga conocimientos en bases de datos y habilidades excepcionales en comunicación y organización. Esta es una vacante presencial.		Responsabilidades:			•	Proporcionar soporte técnico a nuestros clientes. asegurando la resolución eficaz de sus problemas y consultas.		•	Documentar procedimientos y soluciones para mejorar la eficiencia del soporte técnico.		•	Colaborar con el equipo de desarrollo para solucionar problemas técnicos y mejorar los productos.		•	Realizar seguimiento de incidencias y asegurar la satisfacción del cliente.		•	Capacitar a los usuarios en el uso de nuestras aplicaciones y sistemas.	Requisitos:			•	Excelentes habilidades de comunicación verbal y escrita.		•	Capacidad para trabajar de manera organizada y eficiente. gestionando múltiples tareas y prioridades.		•	Experiencia previa en un rol de soporte técnico o atención al cliente.		•	Habilidad para trabajar de manera independiente y en equipo.		•	Actitud proactiva y orientación al cliente.		•	Experiencia en el manejo y administración de bases de datos. específicamente PostgreSQL.		Ofrecemos:			•	Un ambiente de trabajo colaborativo y de apoyo.		•	Oportunidades de desarrollo profesional continuo.		•	Un equipo experimentado y dedicado.		•	Proyectos emocionantes y de vanguardia.,Tiempo Completo,Contrato por tiempo indefinido,A convenir,0,Analista de soporte de software,0,18,Universidad,1,Presencial,False,False,False,
False,False,Kamaytech,Ecuador,Informática / Telecomunicaciones,2024-07-25T11:52:14,,1,,Azuay,,,En Kamaytech. estamos buscando una persona para el puesto de QA de Software que sea meticulosa y apasionada por asegurar la calidad de nuestras soluciones tecnológicas. Este es un rol crucial para garantizar que nuestros productos cumplan con los más altos estándares de calidad y funcionalidad.		Responsabilidades:			•	Realizar pruebas exhaustivas de software para identificar errores. inconsistencias y problemas de usabilidad.		•	Diseñar. desarrollar y ejecutar casos de prueba y scripts de pruebas automatizadas.		•	Documentar los resultados de las pruebas y crear informes detallados sobre los defectos y problemas encontrados.		•	Colaborar con el equipo de desarrollo para garantizar que los problemas se comprendan y se resuelvan de manera oportuna.		•	Participar en revisiones de código y discusiones técnicas para asegurar la calidad desde las primeras etapas del desarrollo.		•	Asegurar que todas las soluciones cumplan con los requisitos especificados y las expectativas del cliente.		•	Mantenerse actualizado con las mejores prácticas de QA y las tecnologías emergentes.		Requisitos:			•	Experiencia en pruebas de software y aseguramiento de la calidad.		•	Conocimiento de herramientas de pruebas automatizadas y manuales.		•	Habilidad para crear y ejecutar casos de prueba detallados y scripts de pruebas.		•	Excelentes habilidades de comunicación verbal y escrita.		•	Capacidad para trabajar de manera organizada y eficiente. gestionando múltiples tareas y prioridades.		•	Experiencia en colaborar con equipos de desarrollo para resolver problemas técnicos.		•	Atención al detalle y habilidad para trabajar en un entorno dinámico y en constante evolución.		Ofrecemos:			•	Un entorno de trabajo colaborativo y de apoyo.		•	Oportunidades de desarrollo profesional continuo.		•	Un equipo experimentado y dedicado.		•	Proyectos emocionantes y de vanguardia.		Si eres una persona orientada al detalle con pasión por la calidad del software y estás interesado en unirte a un equipo dinámico. ¡queremos conocerte! ,Tiempo Completo,Contrato por tiempo indefinido,A convenir,0,Analista de calidad de Software,0,18,Universidad,1,Presencial,False,False,False,
True,True,Vive Green,Azuay,Atención a clientes,2024-07-24T11:56:46,,1,Adaptación al cambio,Azuay,,Atención al cliente,- Asistir en preparación de alimentos	- Atención al cliente	- Revisión y cuadre de inventario semanal	- Manejo de Caja	- Producción de Recetas con instrucciones de la emrpesa,Tiempo Completo,Contrato por tiempo indefinido,470.00 US$ (Mensual),470,Ayudante de cocina,40,19,Educación Básica Primaria,2,Presencial,False,False,False,
False,False,CORPORACION COBOS & COBOS,Ecuador,Contabilidad / Finanzas,2024-07-24T11:28:37,,2,,Azuay,,con Experiencia,Ingreso de Compras	Retenciones	Facturación electrónica	Notas de Crédito	Reporte para declaraciones mensuales	Anexos Contables	Tener sólidos conocimientos contables con esperiencia comprobable	Disponibilidad Inmediata	Aplicar solo interesados,Tiempo Completo,Contrato por tiempo indefinido,460.00 US$ (Mensual),460,Auxiliar Contable,35,25,Educación Técnico/Profesional,1,Presencial,False,False,False,
False,False,Comercial Salvador Pacheco Mora S.A..,Ecuador,Ventas,2024-07-24T11:28:39,,3,,Azuay,,Experiencia en Pintura,Importante Empresa requiere contratar para el área comercial un Vendedor Senior con experiencia en Pintura Arquitectónica que cumpla los siguientes requisitos:		REQUISITOS:	Experiencia en el cargo mínimo 3 años.	Contar con excelentes habilidades de servicio al cliente 	Orientado al cumplimiento de metas	Conocimientos de utilitarios Office 	Responsable	Buena Presencia		Interesados entregar su hoja de vida en nuestra oficina Matriz	,Tiempo Completo,Contrato por tiempo indefinido,700.00 US$ (Mensual),700,Vendedor Senior,,,Educación Básica Secundaria,1,Presencial,False,False,True,4.2
False,False,Corporación Fernandez S.A.,Ecuador,Legal / Asesoría,2024-07-24T08:19:43,,,Asesoría legal,Azuay,,,Asesor Jurídico Asesora a las autoridades y al personal de la institución en lo concerniente a leyes. reglamentos. y demás normas jurídicas aplicadas en la institución. Leyes. Normas. reglamentos. resoluciones y más disposiciones legales vigentes.	Funciones : Desempeñar labores administrativas. como redacción de documentos. oficios. memorándum. atención telefónica. entre otras. Brindar apoyo jurídico a los documentos elaborados en general y cumplir otras labores administrativas que se en encomienden		,Tiempo Completo,Contrato por tiempo determinado,1.300.00 US$ (Mensual),1300,Asistente Juridico y  Legal,50,19,Universidad,50,Presencial,False,False,False,4.2
False,True,tecnocyclo,Ecuador,Ventas,2024-07-16T13:19:02,,1,Ventas,Azuay,Español ,Experiencia ciclismo. motos,Generar ventas a Mayoristas	Establecer y cumplir los objetivos de ventas	Conocer el mercado	Generar y cuidar la relación con los clientes	Brindar asesoría a los clientes	Habilidades para negociar 	,Tiempo Completo,Contrato por tiempo indefinido,A convenir,0,Vendedor,50,25,Universidad,1,Presencial,False,False,False,
False,False,CENTRO RESIDENCIAL PARA PERSONAS ADULTAS MAYORES LOS JARDINES LOSJAR S.A.	,Ecuador,Administración / Oficina,2024-07-16T13:19:04,,2,Adaptación al cambio. Atención al cliente. Contabilidad,Azuay,,,Centro para atención y cuidado de personas adultos mayores con gran trayectoria en la ciudad de Cuenca. Los jardines. requiere una auxiliar de contabilidad-recepcionista. Requisitos:	Sexo: Mujer.	Edad de 25 a 35 años.	Estudios en contabilidad. administracion o ramas afines.	Ingles escrito y hablado.	Experiencia como auxiliar de contabilidad y actividades de recepción mínimo de 2 años.	Manejo de caja chica.	Dinámica.	Extrovertida.	Don de gentes.	Trabajo en Equipo,Beca/Prácticas,Contrato por tiempo indefinido,A convenir,0,Recepcionista auxiliar contable,35,25,Educación Técnico/Profesional,1,Presencial,False,False,True,
False,False,We Connect,Ecuador,Ingeniería,2024-07-15T11:57:23,,,,Azuay,,Desarrollador junior,Con conocimientos en captación de requerimientos. desarrollo e implementación del software. en lenguajes Flutter. Angular. Java.Spring boot kotlin. Postgresql y Firebase. 	,Por Horas,Contrato de obra o labor,A convenir,0,Analista y desarrollador de software,,,Universidad,1,Presencial,False,False,True,
False,False,Maria Jose Callejas,Ecuador,CallCenter / Telemercadeo,2024-07-15T15:00:41,,-1,,Azuay,,Call Center en Cuenca,- Realizar llamadas a clientes con el fin de que se afilien a una aplicación de transporte de carga pesada	- Identificar. contactar a socios conductores y empresas de transporte.	- Presentar nuestros servicios de manera convincente e incorporarlos a la app.	- Alcanzar objetivos de ventas y afiliación de socios conductores.,Tiempo Completo,Otro tipo de contrato,A convenir,0,Asesor comercial,50,18,Bachillerato / Educación Media,1,Híbrido,False,False,True,
False,False,PROCESADORA NACIONAL DE ALIMENTOS C A PRONACA,Ecuador,Administración / Oficina,2024-07-15T15:00:41,,1,Aceptación de errores y fracasos,Azuay,Español ,Con experiencia,El Asistente Administrativo es responsable por prestar apoyo administrativo de alto nivel al equipo de Finanzas y Operaciones y a toda la organización. El Asistente Administrativo colaborará con el Asistente Sénior de Operaciones y del Profesional de Recursos Humanos en momentos de trabajo excesivo.,Tiempo Completo,Contrato por tiempo determinado,A convenir,0,Asistente administración,45,21,Universidad,100,Presencial,False,False,False,
