cambioResidencia,viajar,empresa,ciudad,areaName,fechaHoraPublicacion,fechaPublicacion,experienciaAnos,skills,provincia,idiomas,descripcionTitulo,descripcion,tipoTrabajo,tipoContrato,salarioDescripcion,salario,titulo,edadMaxima,edadMinima,educacionMinima,cantidadVacante,modalidadTrabajo,empresaVerificada,anuncioRelevante,aptoDiscapacitado,promedioEmpresa
False,False,BairesDev LLC,Argentina,Informática / Telecomunicaciones,2024-09-09T13:11:06,,2,Java. Tecnología de la información. Lean. Agile,Azuay,Inglés ,Ref. 0003S,En BairesDev® llevamos 15 años liderando proyectos de tecnología para clientes como Google. Rolls-Royce y las startups más innovadoras de Silicon Valley. Actualmente. contamos con un equipo de 4000 profesionales conformado por el top 1% de la industria trabajando de forma remota desde más de 50 países. 		Al postularte a esta vacante. estarás dando el primer paso en un proceso que va más allá de lo convencional: Buscaremos conocer en profundidad tus habilidades. intereses y expectativas con el objetivo de realizar una búsqueda personalizada y encontrar el rol ideal para ti en BairesDev.		Desarrollador Junior/MidLevel Java en BairesDev		Ser un Desarrollador Java Junior/MidLevel en nuestro Equipo de Desarrollo es como ser un solucionador de problemas a tiempo completo. Esperamos que tus habilidades sean una combinación de experiencia. conocimiento e independencia. La innovación también está en el centro de la estrategia de BairesDev. Por lo tanto. si usted está dispuesto a asumir las tareas más complejas y ser un maestro de su pila de tecnología. Java. entonces usted es probablemente uno de los únicos que estamos buscando.		Principales responsabilidades:		- Trabajar con los equipos de desarrollo de software para recopilar los requisitos y garantizar las mejores prácticas se adhieren.	- Diseñar. implementar y apoyar soluciones para el desarrollo de aplicaciones. seguridad. análisis y gestión del rendimiento.	- Cumplir con los estándares de codificación de seguridad existentes de la industria y de Verizon que se adhieren a los requisitos de análisis fortificado y otras herramientas de revisión de seguridad.	- Ejecutar secuencias de comandos de prueba contra el código para garantizar la entrega de calidad.	- Resolver problemas de código con urgencia.		¿Qué Buscamos?:		- 2+ años de experiencia en Java.	- Experiencia con bases de datos SQL y NoSQL.	- Experiencia con Microservicios y Cloud.	- Conocimiento avanzado de algoritmos.	- Conocimientos de infraestructura IT.	- Manejo intermedio de metodologías ágiles.	- Sólido conocimiento de buenas prácticas. principios SOLID. CLEAN Code y soluciones escalables.	- Conocimiento de patrones de diseño.	- Experiencia desarrollando aplicaciones completas desde cero.	- Experiencia en pruebas automatizadas. y CI/CD pipelines.	- Sólida experiencia con Control de Versiones.	- Nivel avanzado de inglés.		¿Qué Ofrecemos?:		Qué ofrecemos para que tu trabajo (y tu vida) sea más fácil:		- Trabajo 100% remoto: trabaja desde tu casa o donde quieras.	- Compensación en USD o en tu moneda local. como prefieras. muy por encima de la media del mercado.	- Hardware y software.	- Horarios flexibles	- Licencias por mater/paternidad. vacaciones y días festivos nacionales pagos.	- Ambiente laboral multicultural e innovador. perfecto para hacer amigos. colaborar y aprender de las personas más talentosas del mundo.	- Oportunidades de crecimiento y desarrollo profesional a través de mentorías y entrenamientos.		¡Únete a nuestro equipo global!																						,Tiempo Completo,Contrato por tiempo indefinido,A convenir,0,Trabajo Desde Casa Desarrollador Junior/MidLevel Java,,,Universidad,10,,True,False,True,
False,False,COMPANIA NACIONAL DE TRANSPORTES Y COMERCIO S.A.,Ecuador,Almacén / Logística / Transporte,2024-09-08T04:44:18,,,,Azuay,Español ,con/sin experiencia,Importante empresa Comercial y de Distribución requiere contratar un Chofer para Reparto. transporte y entrega de mercadería de nuestros clientes.  Entregar y recibir productos en bodega.		Se Ofrece:		Sueldo básico más beneficios de ley y bonificaciones	Oportunidades de crecimiento profesional y personal.		Horario de Trabajo:	De lunes a viernes. de 08:30 a 17:00.			Requisitos:		• Licencia de conducir	• Educación mínima: Bachillerato / Educación Media	• Edad: entre 20 y 50 años	• Responsable	• Buena Presencia	• Conocimientos: Aceptación de errores y fracasos. Adaptación al cambio,Tiempo Completo,Contrato por tiempo indefinido,590.00 US$ (Mensual),590,Chófer,50,20,Bachillerato / Educación Media,6,Presencial,False,False,True,
False,False,ALMESPANA CÍA. LTDA.,Ecuador,Atención a clientes,2024-09-08T04:04:12,,,,Azuay,,,ALMESPANA CÍA. LTDA. está buscando un Vendedor apasionado y experimentado para unirse a nuestro equipo en Cuenca. Si tienes una fuerte ética de trabajo. una actitud positiva y una pasión por brindar un servicio excepcional. ¡estamos deseando conocerte!		Requisitos:		1. Experiencia comprobada en ventas y atención al cliente.	2. Habilidades demostradas en la provisión de un servicio ágil y personalizado.	3. Una actitud positiva y proactiva. siempre dispuesto a superar las expectativas del cliente.	4. Excelentes habilidades de comunicación y resolución de problemas.	5. Capacidad para trabajar de forma independiente y en equipo.		Responsabilidades:		1. Brindar un servicio excepcional a nuestros clientes. asegurando que sus necesidades se satisfagan de manera oportuna y personalizada.	2. Desarrollar y mantener relaciones sólidas con clientes actuales y potenciales.	3. Identificar nuevas oportunidades de ventas y alcanzar o superar las metas establecidas.	4. Colaborar estrechamente con el equipo para garantizar una experiencia de cliente fluida y sin inconvenientes.	5. Mantener un conocimiento profundo de nuestros productos y servicios. y estar dispuesto a aprender y crecer continuamente.		En ALMESPANA CÍA. LTDA.. nos enorgullecemos de nuestra cultura centrada en el cliente. Buscamos a alguien que comparta nuestro compromiso de proporcionar la mejor experiencia posible a cada cliente. en cada interacción. Si crees que tienes lo que se necesita para ser nuestro próximo Vendedor exitoso. lo invitamos a postularse hoy mismo.		Nota: ALMESPANA CÍA. LTDA. es un empleador que ofrece igualdad de oportunidades. Estamos comprometidos a crear un ambiente de trabajo diverso e inclusivo donde todos se sientan valorados y respetados.		Palabras clave: Agilidad en el servicio. Experiencia personalizada. Actitud positiva. Atención puntual. Personalización. Superar expectativas del consumidor. Proactivo.,Tiempo Completo,Contrato por tiempo indefinido,472.00 US$ (Mensual),472,Vendedor para Cuenca,35,22,Educación Básica Secundaria,1,Presencial,True,False,False,
False,False,NCH ECUADOR SA,Ecuador,Ventas,2024-09-07T04:14:09,,-1,,Azuay,,Lubricantes Industriales en Cuenca,NCH Ecuador 	Gracias por considerar a NCH Latin América en tu siguiente paso de tu carrera profesional. 		Buscamos un Asesor Comercial para brindar soluciones especializadas a clientes nuevos y existentes en un entorno industrial. te enfocarías en el desarrollo de negocios y en asegurar relaciones a largo plazo con clientes. La confianza en la construcción y el mantenimiento de las relaciones profesionales es una necesidad para NCH. 		Si estás buscando hacer una carrera exitosa en ventas industriales ofreciendo productos y soluciones en Lubricación Industrial en un ambiente agradable pero próspero. formar parte de nuestra familia podría ser una opción para ti. 		Un poco sobre nosotros 		Solicitar un nuevo trabajo es como entrar en un territorio inexplorado. Queremos que te sientas 100% seguro sobre el proceso de postulación. el puesto y nuestra empresa antes de comprometer tu tiempo para postularte. para que nada de lo anterior sea una sorpresa. Comencemos con algo de información sobre NCH para que puedas conocernos mejor. 	NCH Lubricants es una división de nuestra compañía NCH Corporation donde somos especialistas en la fabricación y venta de soluciones químicas y de lubricación avanzadas utilizadas para el mantenimiento de equipos y maquinaria industrial. 		Cultura y Beneficios 		Somos una empresa global con un ambiente familiar. que ofrece los mismos beneficios de una corporación internacional con las relaciones personales de una pequeña empresa. Al trabajar en nuestros equipos pequeños y en un entorno muy unido. nunca adivinarías que tenemos más de 7500 empleados. Nos damos cuenta de que un trabajo es más que un simple trabajo. es una extensión de tu vida y tu familia. estamos comprometidos a mantener eso. 		Esta oportunidad te brinda: 	•	Desarrollar un territorio local con productos especializados para Mantenimiento 	•	Atractivo plan de compensación.	•	Oportunidades de crecimiento profesional y personal de acuerdo a tu interés. pero sobre todo a tus resultados. 	•	Capacitación continua en el área técnica y comercial en campo. 	•	Herramientas tecnológicas. 	•	Beneficios laborales. 		Requisitos: 	•	Personalidad emprendedora y energética. 	•	Capacidad para detectar necesidades y soluciones a clientes. 	•	Aptitud para trabajar de forma autónoma. 	•	Fuerte ética de trabajo y actitud entrenable. 	•	Manejo de equipo de cómputo. Microsoft Office y herramientas tecnológicas. 	•	Vehículo propio. licencia de conducir (Indispensable). 	•	Carrera Técnica concluida 		¡Esta compañía existe debido a su fuerza de ventas! ¡Bienvenido a bordo!,Tiempo Completo,Contrato por tiempo indefinido,A convenir,0,Asesor Comercial,,,Educación Técnico/Profesional,1,Presencial,True,False,True,4.5
True,False,ALMESPANA CÍA. LTDA.,Ecuador,Almacén / Logística / Transporte,2024-09-06T05:34:30,,2,,Azuay,,,Título: Jefe de Logística		Empresa: ALMESPANA CÍA. LTDA.		Descripción:		ALMESPANA CÍA. LTDA. está buscando un Jefe de Logística experimentado y proactivo para unirse a nuestro equipo en constante crecimiento. El candidato ideal será responsable de coordinar las entregas y distribución de mercadería a los distintos almacenes de electrodomésticos. el mantenimiento de la flota vehicular.		Requisitos:		1. Experiencia comprobada en gestión de logística y distribución en empresas de retail o similares.	2. Excelentes habilidades de liderazgo y gestión de personal. con experiencia previa en el manejo de personal de bodega.	3. Capacidad demostrada para coordinar y programar entregas y distribuciones de manera eficiente y oportuna.	4. Conocimientos sólidos en el mantenimiento y gestión de flotas vehiculares.	5. Habilidades excepcionales en la resolución de problemas y toma de decisiones.	6. Gran capacidad de organización y atención a los detalles.	7. Disponibilidad para trabajar en horarios flexibles y bajo presión.	8. Disponibilidad para cambio de ciudad.		Responsabilidades:1. Programar y supervisar la distribución de la mercadería a nuestros almacenes. asegurando la disponibilidad de productos en nuestras tiendas.	2. Gestionar y coordinar el mantenimiento preventivo y correctivo de la flota vehicular. asegurando su disponibilidad y eficiencia.	3. Manejar y liderar al personal de bodega. brindando capacitación y orientación para alcanzar los objetivos logísticos.	4. Implementar y monitorear indicadores de desempeño logístico. identificando oportunidades de mejora y eficiencia.	5. Colaborar estrechamente con otros departamentos para garantizar la fluidez en las operaciones y la satisfacción del cliente.		ALMESPANA CÍA. LTDA. ofrece un ambiente de trabajo dinámico y desafiante. oportunidades de crecimiento profesional y un paquete de beneficios competitivo. Si está buscando un desafío que aproveche su experiencia y habilidades en logística. lo invitamos a postularse para este importante rol en nuestra empresa.,Tiempo Completo,Contrato por tiempo indefinido,1.000.00 US$ (Mensual),1000,Jefe de Logistica,50,30,Universidad,1,Presencial,True,False,False,
False,False,ALMESPANA CÍA. LTDA.,Ecuador,Almacén / Logística / Transporte,2024-09-06T04:54:12,,,,Azuay,,,Título: Ayudante de Chofer en ALMESPANA CÍA. LTDA.		Descripción: ALMESPANA CÍA. LTDA. se complace en anunciar una oportunidad laboral para el puesto de Ayudante de Chofer. Nos dedicamos a brindar soluciones de transporte eficientes y confiables. y estamos buscando un candidato entusiasta y responsable que se una a nuestro equipo.		Responsabilidades:		1. Ayudar al chófer en la carga y descarga de bienes hasta su destino final.	2. Asegurar los bienes durante el transporte para evitar daños.	3. Apoyar al chófer en la búsqueda de rutas para la entrega eficiente de productos.	4. Acomodar. contar. cargar. descargar. revisar y limpiar tanto el material que se recibe como el que se entrega.		Requisitos:		1. Experiencia previa como ayudante de chófer o en cargas y descargas.	2. Capacidad para trabajar en equipo y seguir instrucciones.	3. Habilidades para la resolución de problemas y toma de decisiones.	4. Disponibilidad para viajar y trabajar en horarios flexibles.	5. Licencia de conducir válida (TIPO C )y buen récord de manejo.	6. Fuerte ética de trabajo y compromiso con la seguridad y la calidad del servicio.		ALMESPANA CÍA. LTDA. ofrece un ambiente de trabajo dinámico y gratificante. oportunidades de crecimiento profesional y un paquete competitivo de compensación y beneficios. Si está buscando una carrera desafiante y gratificante en el campo del transporte. lo invitamos a postularse para esta excelente oportunidad.		ALMESPANA CÍA. LTDA. es un empleador que ofrece igualdad de oportunidades. Estamos comprometidos con la diversidad e inclusión y damos la bienvenida a aplicaciones de personas calificadas de todos los orígenes étnicos. religiosos. sexuales. de género. y con discapacidades.		Para postularse. envíe su currículum vitae y una carta de presentación que explique por qué está calificado para este puesto a nuestra dirección de correo electrónico corporativo.ALMESPANA CÍA. LTDA. agradece la consideración de todos los solicitantes. pero solo se comunicará con los candidatos seleccionados para una entrevista.,Tiempo Completo,Contrato por tiempo indefinido,480.00 US$ (Mensual),480,Ayudante Chofer,36,27,Educación Básica Secundaria,1,Presencial,True,False,False,
False,False,FRACTALIA PERU SOCIEDAD ANONIMA,Perú,Informática / Telecomunicaciones,2024-09-06T04:14:14,,1,,Azuay,,Hibrido,Únete a nuestro equipo como Gestor de Proyectos y gestiona proyectos de conectividad. digitales móviles y otros. desde su inicio hasta su finalización.		Responsabilidades:		Gestionar proyectos de baja y media complejidad.	Manejar conflictos con proveedores y clientes.	Gestionar SLAs con diferentes áreas.	Ser interlocutor global para proyectos de conectividad. datos fijos. routing and switching. soluciones digitales móviles y otros.	Coordinar Kick Off interno y externo.	Gestionar responsabilidades con proveedores.	Coordinar pruebas de aceptación de servicio.	Gestionar posibles ventanas de mantenimiento.	Transferir servicios a Atención al cliente.	Requisitos:		Formación en Ingeniería Electrónica. Telecomunicaciones. Redes de la Información o afines.	Capacitación en Gestión de Proyectos (metodología PMI o similar).	Conocimientos intermedios de MS Project.	Conocimientos en Microinformática. Redes de computadoras. enlaces de datos. sistemas operativos. Routing.	Manejo del paquete Office.	Habilidades interpersonales. dinamismo y capacidad para trabajar en equipo.	Experiencia mínima de 1 año en gestión de proyectos.	¿Qué ofrecemos?		Ambiente de trabajo dinámico y colaborativo.	Proyectos desafiantes y de gran impacto.	Equipo de profesionales apasionados.	Paquete de compensación y beneficios competitivo.	Posibilidades de crecimiento y desarrollo profesional,Tiempo Completo,Contrato por tiempo indefinido,600.00 US$ (Mensual),600,Gestor de Implementaciones,,,Universidad,5,Híbrido,True,False,False,
False,False,COHECO S.A,Ecuador,Ingeniería,2024-09-06T04:14:06,,3,,Azuay,,Técnico de Ajuste de Ascensores,"COHECO. requiere contratar TÉCNICO DE AJUSTE para la ciudad de CUENCA. el mismo que debería cumplir con el siguiente perfil:		OBJETIVO DEL PUESTO DE TRABAJO:	Realizar ajustes de equipos de transporte vertical.		ACTIVIDADES DEL PUESTO DE TRABAJO:		Ajustar equipos de transporte vertical.	Ejecutar trabajos de reconstrucción emitidos por departamento técnico. fabrica o cliente.	Dar soporte en temas electrónicos y/o mecánicos a otras áreas del departamento técnico.	Capacitar al personal a su cargo.	Realizar trabajos de reingreso a mantenimiento	Poner en lenta equipos en proceso de instalación.	Coordinar actividades de grupos de ajuste en proyectos grandes.	Reportar fallas y faltantes en equipos.	Inspeccionar equipos por ajustar.	Entregar equipos a control de calidad y clientes.	Asistir a reuniones de obra.	Ejecutar o apoyar en cualquier otra función asignada de forma ocasional o permanente requerida por la empresa.		REQUISITOS DE ESTUDIO:		Electricidad. electrónica. electromecánica - Tecnología Graduado		REQUISITOS DE EXPERIENCIA EN:		Tipo de Experiencia : SUPERVISOR TÉCNICO  (ó supervisor técnico)	Tiempo Requerido : 2 Años		""COHECO. garantiza la igualdad de oportunidades a candidatos. sin ningún tipo de restricción. respetando raza. sexo. maternindad/paternidad. creencias. ideología. orientación sexual. nacionalidad. origen social. salud. edad. discapacidad u otras características personales en cada uno de los procesos de selección de acuerdo a nuestra Política de reclutamiento y selección de personal.""	",Tiempo Completo,Contrato por tiempo indefinido,A convenir,0,Técnico Eléctrico o Electrónico,35,28,Universidad,1,Presencial,True,False,True,4.5
False,True,Compufacil Cía. Ltda.,Ecuador,Ventas,2024-09-05T04:34:13,,3,,Azuay,,Con experiencia,Realizar seguimiento a loas planificaciones diarias de los asesores comerciales		Receptar de parte de los asesores comerciales y aprobar solicitudes de cotizacion según aplique el caso 		Realizar cotizaciones y facturación de los asesores corporativos 		Coordinar la logística el despacho de las ventas efectuadas por los asesores corporativos 		Supervisar y organizar las jornadas de ventas basadas en el inventario		Realizar cotizaciones que maneja la empresa directamente		Mantener un registro de ventas organizado en base a la jornada.		Manejar el correo de ventas y direccionar las solicitudes al canal que corresponda 		Asistir a capacitaciones de ventas esenciales y desarrollar un conocimiento de todos los servicios y productos de la empresa		Realizar un control de visitas diarias con los asesores corporativos 		Crear promociones en base al inventario 		Elaborar jutno con la Gerencia  General el presupuesto de ventas y tabla de comisiones		Solicitar precios a las gerencias para negociaciones  de servicio 		Preparar y organizar el material de apoyo para los asesores (carpeta comercial.listado de precios. base de datos)		Reemplazar en caso de emergencia al personal del departamento 		Excelentes habilidades de comunicación verbal y escrita. 	Habilidades en las relaciones interpersonales. 	Una atención telefónica correcta. 	Habilidades de servicio de atención al cliente. 	Interés y comprensión del funcionamiento empresarial 	Paciencia y perseverancia. 	Mostrarse seguro y entusiasta. 	Mantenerse al día sobre los avances de las nuevas tecnologías.,Tiempo Completo,Contrato por tiempo indefinido,A convenir,0,Supervisor de Ventas,50,30,Universidad,1,Presencial,True,False,True,
False,False,Cooperativa JEP,Ecuador,Ventas,2024-09-05T04:14:06,,,,Azuay,,Cuenca,BUSCAMOS TU TALENTO		Nos encontramos en la búsqueda de un Asesor Comercial para Cuenca: 		Actividades esenciales del cargo: 	Comercializar los productos y servicios que oferta la institución. mediante la gestión de campo. 	Buscar socios que quieran invertir su dinero 	Administrar el portafolio de cartera de socios e inversionistas que le correspondan. 		Requisitos: 	Le guste el trabajo de campo. 	Disponibilidad en horarios. 	Trabajo en cumplimiento de metas 	Movilización propia 	Buena presencia 		Beneficios: 	La institución ofrece salario competitivo. más comisiones. 	Crecimiento profesional y personal.,Tiempo Completo,Contrato por tiempo indefinido,A convenir,0,Asesor Comercial Trabajo fuera de oficina,,,Bachillerato / Educación Media,2,Presencial,True,False,False,4.5
True,False, Casa Crédito,Ecuador,Informática / Telecomunicaciones,2024-09-04T17:16:35,,2,JavaScript. PHP. Laravel. MySql,Azuay,Español ,De Planta en Cuenca,Título de tercer nivel en Ingeniería en Software. sistemas o afines		REQUISITOS:	Experiencia mínima de 2 años	Conocimientos avanzados en PHP. Laravel. JavaScript. Base de datos SQL	Desarrollo y mantenimiento en sistema CRM		Responsabilidades:	Desarrollo de aplicaciones web utilizando PHP y el framework Laravel.	Implementación de interfaces de usuario dinámicas y funcionales con JavaScript.		Diseño y gestión de bases de datos SQL. asegurando la integridad y optimización de los datos.	Mantenimiento y actualización de sistemas CRM existentes.	Colaboración con equipos multidisciplinarios para definir. diseñar y enviar nuevas funcionalidades.	Solución de problemas técnicos y mejora continua de las aplicaciones.		Si eres apasionado por el desarrollo de software y cumples con los requisitos. ¡queremos conocerte! Envía tu CV y portafolio de proyectos a ****@casacredito.com,Tiempo Completo,Otro tipo de contrato,800.00 US$ (Mensual),800,Ingeniero en Software,35,25,Universidad,1,Presencial,False,False,False,
False,False,COHECO S.A,Ecuador,Mantenimiento y Reparaciones Técnicas,2024-09-04T17:16:43,,-1,,Azuay,,Bachiller o Tecnólogo Electrónico en Cuenca,"COHECO. requiere contratar AYUDANTE C DE MANTENIMIENTO para la ciudad de CUENCA. el mismo que debería cumplir con el siguiente perfil:		OBJETIVO DEL PUESTO DE TRABAJO:	Apoyar en el mantenimiento preventivo. correctivo planificado y de emergencias en ascensores y escalera eléctricas bajo los lineamientos estipulados en el departamento de mantenimiento		ACTIVIDADES DEL PUESTO DE TRABAJO:		Ejecutar los trabajos de mantenimiento preventivo a equipos de transporte vertical. bajo supervisión.	Realizar mantenimiento correctivo planificado de complejidad alta. media y baja. en ascensores y escaleras de acuerdo a manuales de mantenimiento. bajo supervisión.	Colaborar con otras áreas o departamentos coordinando con su jefe inmediato .	Informar las anomalías que se presenten en el mantenimiento de los equipos.	Registrar las actividades de seguridad establecidas por la empresa.	Llenar la solicitud de materiales necesarios para la ejecución de los procesos de mantenimiento.	Entregar los registros que se generen en los procesos de mantenimiento. firmados por el cliente.	Reportar diariamente la asistencia del personal asignado al equipo. utilizando los recursos determinados por la empresa.	Cumplir con las actividades diarias del mantenimiento preventivo o correctivo en los equipos asignados.	Ejecutar o apoyar en cualquier otra función asignada de forma ocasional o permanente requerida por la empresa.		REQUISITOS DE ESTUDIO:		Bachillerato técnico industrial - electricidad. electrónica o electromecánica - Bachillerato Graduado	ó Electricidad. electrónica. electromecánica - Tecnología Graduado		REQUISITOS DE EXPERIENCIA EN:		Ayudante en electricidad. electromecánica. electrónica (6 meses)(indispensable)		""COHECO. garantiza la igualdad de oportunidades a candidatos. sin ningún tipo de restricción. respetando raza. sexo. maternidad/paternidad. creencias. ideología. orientación sexual. nacionalidad. origen social. salud. edad. discapacidad u otras características personales en cada uno de los procesos de selección de acuerdo a nuestra Política de reclutamiento y selección de personal.""",Tiempo Completo,Contrato de Aprendizaje,A convenir,0,Ayudante Mantenimiento Eléctrico,28,20,Bachillerato / Educación Media,1,Presencial,True,False,False,4.5
